Name,upload_date,category,view_count,like_count,dislike_count,frames,number_shots,dark_perc_std,dark_perc_mean,saturated_perc_std,saturated_perc_mean,red_perc_std,red_perc_mean,white_perc_std,white_perc_mean,tags
$1 THRIFT HAUL (try on goodwill outlet haul)-oNXSyNbrXrk,20180315,Howto & Style,782897,25090,229,17663,274,46.82920301,83.37702421,9.791469875,3.005607378,7.952169981,2.060965379,54.32104307,254.5442821,"$1 thrift haul, thrift haul 2018, thrift haul try on, thrift haul goodwill, thrift haul goodwill outlet, thrift haul goodwill 2018, goodwill outlet, goodwill haul, try on thrift haul, try on thrift haul 2018, try on thrift haul goodwill, try on goodwill haul, thrift haul designer, thrift store haul designer, thrifting haul 2018, thrift haul for resale, spring thrift haul, thrift store haul, thrift store finds, cheap thrift haul, thrift haul"
5 Fashion Resolutions for 2017-s2O7rs2sk8A,20170105,Howto & Style,14887,565,5,11327,13,79.28710678,47.74299432,0.48072954,0.118539896,0.116481792,0.112767891,65.06567875,275.6989895,"fashion resolution, fashion resolution 2017, new years resolution, new years resolution 2017, new years resolution fashion, new years resolution fashion 2017, new years resolution style, new years resolution beauty, new years resolution style 2017, new years resolution beauty 2017, style resolution, style resolution 2017, improving style, how to improve your style, find your style, 2017 trends, 2017 trends fashion, capsule wardrobe, minimalist wardrobe, minimalism, bestdressed"
5 Summer Closet Essentials-xIB2JnjkQV4,20160720,Howto & Style,15999,577,3,8872,83,31.71501394,180.1966353,0.909400768,0.602390918,0.303832261,0.114060122,19.50083391,136.2339289,"summer essentials, summer essentials 2016, summer clothing essentials, summer essentials clothes, essentials for summer, wardrobe essentials, closet essentials, closet essentials 2016, closet essentials summer, basic closet essentials, closet essentials summer 2016, wardrobe essentials 2016, summer wardrobe essentials, summer closet essentials, summer closet essentials 2016, bestdressed, summer clothing esssentials 2016, basic clothing essentials"
5 WAYS TO REWEAR YOUR NYE DRESS-jGHiyhotAqw,20180114,Howto & Style,56138,2667,27,6871,151,56.8170882,74.48891085,0.541510814,0.387256624,12.62494016,12.31959816,71.31640619,261.8624909,"how to rewear a dress, how to rewear a nye dress, how to rewear a new year's eve dress, how to rewear a new years dress, outfit ideas, outfit ideas 2018, how to restyle a dress, wear a dress as a skirt, ways to style a dress, different ways to style a dress, ways to style a black dress, diy restyle clothes, restyle dress, outfit ideas winter, party outfit ideas, outfit ideas party, basics mashup, one dress many ways to wear"
8 Easy Heatless Back To School Hairstyles-Q49yybBSLuI,20160908,Howto & Style,28998,958,7,8402,83,49.41890811,90.15393819,0.677053151,0.202435065,0.182479933,0.048015873,43.1755367,248.0044222,"easy hair tutorial, quick hairstyles, bestdressed, hairstyles for medium hair, hairstyles for school, back to school hairstyles, hair tutorial, hair tutoiral for medium hair, easy hairstyles, easy hairstyles for school, easy harstyles for medium hair, back to school 2016, back to school hairstyles 2016, heatless hairstyles, heatless hairstyles for school, heatless hairstyles for school 2016, quick hairstyles for school, easy hairstyles 2016"
10 WAYS TO (re)WEAR A DRESS-Z2btCqHejx4,20190404,Howto & Style,2129044,150605,519,11617,150,25.5126982,58.25446475,0.904381593,0.33314459,68.03649545,38.42155446,76.60696976,221.9822083,"spring outfit ideas, outfit ideas, outfit ideas 2019, fashion, 10 ways to wear a dress, how to rewear a dress, spring dress, summer dress, basics mashup, 10 basics, styling basics, how to style a dress, style with me, 50 outfit ideas for when you have nothing to wear, 50 outfit ideas, 20 outfit ideas, casual outfit ideas, ootw, spring ootw, spring lookbook, how to style basics, how to make your basic clothes look cute, spring basics, summer basics, styling tips"
30 BACK TO SCHOOL OUTFITS (yes it's that time of year i'm so sorry)-InVOyJJoNK8,20180809,Howto & Style,2590831,105436,1034,10988,120,17.4854139,36.74035189,7.608561012,1.888410829,16.79180032,4.666232067,56.32305991,215.287634,"back to school outfits, back to school outfits 2018, back to school outfit ideas, back to school outfit ideas 2018, back to school outfits 2018-2019, back to school clothing haul, casual school outfits, outfits of the week high school, outfits of the week college, back to school lookbook, high school lookbook, first week of school outfits, ootw first week of school, college lookbook, college ootw, cute school outfit ideas, easy school outfit ideas, casual school outfit ideas"
30 BACK TO SCHOOL OUTFITS to help you survive the school year-PlBaIvxsqys,20190822,Howto & Style,1961810,144125,483,11215,167,16.67062756,119.9358626,5.260447861,1.885211293,5.180443189,6.389854427,17.65507563,188.0123112,"back to school outfits, outfit ideas, outfit ideas for school, school outfit ideas, 30 school outfit ideas, fall outfit ideas, outfit ideas fall, fall trends, ootw, ootw first week of school, high school outfits, ootw college, ootw high school, outfits for school, casual outfit ideas, 50 outfits, 50 outfits for when you have nothing to wear, 20 outfit ideas, 20 school outfit ideas, realistic school outfit ideas, comfortable outfit ideas, back to school haul"
50 FACTS ABOUT ME-_Sedxj2X7-k,20171130,Howto & Style,203513,9100,38,9254,11,55.33818686,311.802623,2.061108817,1.933135115,0.539481297,0.541335397,48.80857932,65.02009341,"50 facts about me, 50 facts about me 2017, short film, short artsy film, 50 facts about me bestdressed, bestdressed, chatty grwm, all about me, about me, get to know me better, q and a, short film 2017, 500 days of summer, 25 facts about me, 25 facts about me 2017, the truth about youtube, get to know me"
50 OUTFITS for when you have nothing to wear-PCOo8AW4oI0,20190228,Howto & Style,10408493,702153,4693,18365,231,24.32094073,84.51210361,12.48658491,2.442883354,11.43081488,6.508070905,36.70111085,235.3004418,"50 outfits, outfit ideas, outfit ideas for school, spring lookbook, winter lookbook, winter outfit ideas, outfit ideas 2019, outfit ideas for college, cute outfit ideas, outfit ideas for spring, spring 2019 trends, styling tips, outfit 101, how to put together an outfit 101, fashion, what to do when you have nothing to wear, nothing to wear, wardrobe basics, closet basics, pattern mixing, dress into tshirt, diy tube top, outfit inspo, casual outfit ideas"
a lil thrifting adventure + try on haul-tn_PvwGlgCw,20180517,Howto & Style,633013,21561,163,11871,171,78.50988788,114.9654006,3.417071712,1.632977405,26.37376107,14.59361808,100.3959592,153.4644392,"come thrifting with me, come thrifting with me 2018, come thriting with me goodwill, come thrifting with me vlog, come thrifting with me la, thrift haul, thrift store haul, thrift haul try on, thrift haul 2018, thrift haul try on 2018, goodwill haul, goodwill haul 2018, goodwill haul try on, try on thrift haul, try on thrift haul summer, try on thrift haul 2018, thrift vlog 2018, thrift with me, try on thrift haul spring"
a big fat post-grad existential crisis-KA0nGrdrG5A,20190530,Howto & Style,763160,85735,325,11631,69,41.06435045,38.06929041,0.94041123,0.263051477,127.5926668,61.60249618,111.375918,242.3640985,"post grad, post grad life, existential crisis, best dressed vlog, best mess, post grad depression, life after college, graduating college, post grad plans, best dressed, quarter life crisis, mid life crisis, life crisis, workaholic, consumerism, my truth, existenial, ucla, best dressed college, best dressed ucla, my college experience, graduating early, graduating in 3 years, adulting, becoming an adult, trying to adult, college graduate"
a quick channel update _really not that dramatic-Kk8HqLBkoT0,20200326,Howto & Style,1042331,121709,642,9350,42,9.759294231,225.4189842,0.064119941,0.047334995,3.108964782,8.435886644,5.554429214,25.78815128,"things are changing, dolan twins, update, burnout, mental health, youtuber burnout, bestdressed, youtube burnout, taking a break, i'm taking a break"
a realistic 'what i got for christmas'-JdOts_9VIss,20181228,Howto & Style,941392,64290,390,10630,85,17.14763955,115.6423268,2.072730939,0.782809367,3.396966196,4.328282828,39.15481333,216.9847705,"what i got for christmas, christmas haul, what i got for christmas 2018, what i got for christmas haul, christmas haul 2018, huge christmas haul, realistic what i got for christmas, gist ideas, gift ideas 2018, gift ideas for parents, gift ideas for teen girls, what i actually got for christmas, clothing haul, best dressed, what i got for my birthday, waht i got for christmas 2017, wat i got for christmas 2019"
a sPiCy summer thrift haul-5XaoizYNkr4,20180726,Howto & Style,1530615,57349,450,32178,409,37.245822,44.83864769,26.10382308,10.36389375,16.59173668,11.06307142,57.29522809,270.9540072,"thrift haul, thrift haul 2018, thrift haul try on, thrift haul goodwill, thrift haul vintage, thrift haul summer 2018, thrift haul summer, summer thrift haul, thrift store haul, thrift shop haul, big ass thrift haul, huge thrift haul, $100 thrift haul, huge try on thrift haul, back to school thrift haul, thrift flip, thrifted diy, thrifted transformation, thrift shopping haul, thrift shopping, thrift shopping at goodwill, thrift haul vintage dresses"
a week in my ~gLaMoRoUS~ life-8yX8sTWv5D8,20181213,Howto & Style,1316640,63982,217,14597,604,62.02137959,108.2177905,8.506051478,2.272818225,20.30743346,11.18912822,78.6032818,165.1108383,"a week in my life, week in my life, day in my life, vlogmas 2018, vlogmas day 1, bestdressed vlog, best dressed vlog, day in the life of a youtuber, week in the life, college week in my life, finals week vlog, exams vlog, ucla vlog, college vlog, film school vlog, school vlog, week in my life college, college vlog 2018, life of a youtuber, vlogmas, vlogmas college, weekly vlog, november vlog, december vlog, LA vlog, los angeles vlog, living in la, college in la"
A WEEK WITHOUT A PHONE-xJq0MNj6ua8,20190411,Howto & Style,1752585,94458,598,31473,546,76.93220435,103.8436725,2.758198274,0.343415325,11.74259099,4.972902734,90.58297094,202.8013592,"24 hours without a phone, no phone for a day, a week without a phone, phone addiction, social media addiction, quitting social media, goodbye social media, no phone for a week, smartphone addiction, 24 hours without my phone, manipulated tricked brainwashed, week in my life, weekly vlog, phone experiment, no phone for a month, living without a smartphone, living without a phone, i lived without a phone for a week, 7 days without a phone, digital minimalism"
"all the tea you need to know about me (boys, tinder, plans after college)-9z7wKjeazh4",20180908,Howto & Style,1014854,45660,230,32029,179,37.86105077,66.14186469,17.04312475,1.181127134,16.69843613,4.489588994,59.51520163,220.8584078,"spilling the tea, spilling the youtube tea, all the tea you need to know about me, spilling the tea questions, you ask i answer, you ask we answer, tinder storytime, bestdressed, bestdressed q and a, bestdressed questions, questions and answers, instagram q and a, living in la, college q and a, youtube q and a, tinder date, tinder horror story, tinder date storytime, tinder date story, let's talk about sex, girl talk, girl talk sex, sex q and a, teenage youtuber"
altering my clothes while bleeding out of my vagina -Uxzro6S-uHs,20181125,Howto & Style,1577375,100677,673,19387,180,34.17209665,60.35500237,0.502031062,0.157158647,4.45484941,6.539126623,53.07836108,237.7492053,"altering clothes, easy alterations, alter clothes without sewing machine, alter clothes by hand, alter clothes at home, alter clothes that are too big, alter thrift clothes, diy alter clothes, alter old clothes, girl talk, girl talk sex, let's talk about sex, girl talk periods, girl talk masturbation, sex ed, girl talk periods 101, periods 101, girl talk 2018, thrift flip, thrift flip 2018, altering pants, hem pants, hem pants without cutting, make skirt smaller"
an indecisive summer haul ft. my broke ass-JgV1E5IHZUg,20180614,Howto & Style,413754,15746,139,19514,238,33.05055087,50.84491806,10.6382733,1.678035631,17.58578162,9.960601532,48.74447133,275.809117,"summer haul, summer try on haul, summer haul 2018, summer clothing haul, summer haul try on, try on clothing haul 2018, summer try on clothing haul, try on haul summer 2018, try on haul summer, try on haul urban outfitters, try on haul afforable, try on haul la, clothing haul, huge summer haul, huge clothing hual, huge try on haul, summer trends, asos haul"
APARTMENT HUNTING IN LA (a strugglebus saga)-6uIY6vZPGDw,20190221,Howto & Style,1181431,63126,283,21478,548,64.50333176,113.9662616,2.374203705,1.072172472,7.624442155,3.687834225,73.5235607,153.5008642,"apartment hunting in la, apartment hunting in los angeles, apartment hunting los angeles, moing to la, moving to los angeles, how to find an apartment, i'm moving, moving vlog, moving to la vlog, apartment hunting tips, apartment hunting vlog, la apartment hunting vlog, apartment shopping, finding an apartment in la, how to find an apartment in los angeles, how to find an apartment in la, cost of living in la, cost of living in los angeles"
ashleys big sis advice,20181227,People & Blogs,944543,54530,183,26289,243,29.09283022,107.4810278,0.426027097,0.043317348,49.90795875,17.86995529,50.71065708,181.2542667,"dating advice, online dating advice, life advice, how to get your shit together, hwo to be more productive, girl talk, girl talk 2019, girl talk relationships, relationship advice, boyfriend tag, how to get a boyfriend, how to tell if a boy likes you, how to tell if a guy likes you, ucla film school, high school advice, advice for high schoolers, my college experience, apartment hunting in la, cost of living in la, how to get over a breakup, how to get over your ex"
ASHLEY'S DAY OFF-BFpbr4bfVZw,20180927,Howto & Style,311620,27016,134,5956,207,73.79575697,129.7370749,1.792016829,0.399600168,4.842520168,1.653922559,65.36329852,74.00863636,"lookbook, short film, ferris bueller's day off, ferris buellers day off, ferris bueller, LA, los angeles, fall lookbook, 2018, fall lookbook 2018, student film, la vlog, day in my life, adventure, twist and shout, twist n shout, life moves pretty fast, ferris bueller opening, music video, outfits of the week, ootw, fall outfit ideas, outfit inspo, outfit ideas, nasty gal, la lookbook, 80s lookbook"
ashley's guide to thrifting + reselling clothes-kKotxLrEKHE,20180628,Howto & Style,439856,17777,106,34999,233,41.21684105,65.46558873,1.409664016,0.280713058,1.2850134,0.590394206,56.21335936,271.9233942,"how to thrift and resell, how to thrift like a pro, how to thrift like a teen, how to thrift clothes, how to thrift shop at goodwill, how to thrift shop like a pro, thrifting and reselling, thrifting and flipping, thrifting and selling, thrifting and reselling clothes, thrifting and reselling clothes online, how to sell on depop, depop selling, depop vs poshmark, instagram shop, instagram store, starting an online clothing business, how to sell on poshmark"
BACK TO SCHOOL LOOKBOOK-ibWHC3ZYXAU,20180916,Howto & Style,937558,103540,361,6452,202,84.23953786,105.4333068,48.6561098,19.6026936,64.78184632,42.18066077,77.47923932,139.126855,"back to school lookbook, back to school lookbook 2018, back to school outfit ideas, outfit ideas for school, ootw first week of school, ootw for school, outfits for school, fall lookbook, fall lookbook 2018, back to college lookbook, back to college outfit ideas, college outfits, back to school outfits 2018, college lookbook, cute school outfit ideas, easy school outfit ideas, casual school outfits, short film, music video, fall outfit ideas, fall ootw, fall outfits 2018"
BACK TO SCHOOL THRIFTING + try on haul-DQ5IDINCMfw,20180823,Howto & Style,1246461,53969,246,17208,454,57.71183045,90.65797283,17.52471281,8.601712977,9.369864118,4.381018377,73.43064702,191.0535816,"thrift with me, thrift with me 2018, thrift with me goodwill, back to school shopping, back to school thrifting, try on thrift haul, thrift haul try on, thrift haul, thrift haul 2018, try on thrift haul 2018, back to school thrift haul, fall thrift haul, fall thrift haul 2018, back to school haul, back to school clothing haul, thrift with me try on haul, come thrifting with me, come thrifting with me 2018, come thrifting with me goodwill, come thrifting with me try on haul"
"BACK TO SCHOOL TRY-ON HAUL 2017 (zara, american eagle, abercrombie)-P04oNUPrF50",20170826,Howto & Style,148300,4639,46,17204,167,25.08608309,46.74478705,1.695314168,1.458703999,5.425810403,2.567890897,45.05048979,276.8466448,"try on back to school haul, try on haul back to school, try on clothing haul back to school, try on haul back to school 2017, haul 2017 try on, haul 2017 back to school, haul 2017 back to school clothing, american eagle haul 2017, abercrombie and fitch haul 2017, zara haul 2017, affordable clothing haul, try on haul 2017 school, try on haul 2017 college, back to school clothing haul, back to school haul, back to school haul try on, haul fall 2017, try on haul fall 2017"
Brandy Melville Lookbook _ Fall_Winter 2016-BjEvA_F6gmA,20160122,Howto & Style,27005,586,5,6548,59,38.11824633,66.28944714,0.004343244,0.001119687,24.81110489,8.910409123,83.42243004,273.5049115,"brandy melville, brandy melville lookbook, brandy melville photoshoot, brandy melville outfits, brandy melville inspired outfits, brandy melville outfit ideas, styling brandy melville, outfit ideas, outfit ideas for winter, winter lookbook 2015, winter lookbook 2016, winter outfit ideas, winter outfits 2015-16, winter outfit ideas for school, outfit ideas for school, outfit ideas for fall, fall outfit ideas, styling winter outfits, brandy melville haul, brandy melville 2016"
"Chatty Get Ready With Me _ Starting a YouTube Channel, College Applications & Working in Retail-aRa8TAg9u2o",20150928,Howto & Style,56478,2024,16,13094,50,16.12099341,60.96402014,5.720132581,9.468498173,4.345596999,12.85387046,14.25379517,78.71360724,"get ready with me, Get, ready, with, me, beauty, makeup, makeup routine, Retail (Industry), Fashion (Industry), Cosmetics (Quotation Subject), Work, College Application (Literature Subject), college, applications, chatty, talk, drugstore, Talking, drugstore makeup, chatty get ready with me, starting, youtube channel, youtube, starting a youtube channel, job, retail job, working in retail, outfit, fashion, Channel"
College Dorm Closet Tour + Organization Tips-rlsBbGTB7X0,20170605,Howto & Style,65358,2076,18,14648,229,49.48738267,130.0604941,2.132810994,1.751981547,19.01139931,14.59598488,60.20222728,155.2233385,"college dorm tour, college dorm tour 2017, college dorm closet, college dorm closet organization tips, college dorm organization, college dorm organization 2017, college dorm organization tips, college dorm room organization, dorm tour 2017, dorm room tour, dorm closet organization, dorm closet, dorm closet tour, dorm closet hacks, dorm closet ideas, dorm room closet organization, bestdressed, dorm wardrobe"
COLLEGE OOTW _ what i've been wearing lately-kYF9laBNGN8,20180201,Howto & Style,146041,5666,23,3644,153,68.68919103,79.50564972,4.488136594,2.06664812,12.23932348,6.010514752,101.1032082,207.1212977,"ootw college, ootw college edition, ootw college 2018, ootw college winter, winter ootw, ootw january, ootw 2018, ootw winter, ootw january casual outfits, ootw january 2018, winter outfits 2018, winter outfit ideas 2018, college outfits of the week, college outfits 2018, college outfits winter, college outfit ideas, outfit ideas for school, outfit ideas for school 2018, outfit idea 2018, what i wore this week, what i wore january, college lookbook, college lookbook 2018"
Come Shopping with Me! Finding the Perfect Pair of Jeans-NKEiiBZQEkk,20170413,Howto & Style,129595,3719,21,14685,258,64.95921965,101.160366,5.367134524,0.927977028,18.01872456,5.785937789,80.59490552,219.6394003,"buying jeans, buying jeans women, come shopping with me, come shopping with me for jeans, how to buy jeans, how to buy jeans that fit, how to buy jeans for women, how to buy jeans that fit properly, how to buy the perfect jeans, how to buy the perfect pair of jeans, how to find the perfect pair of jeans, how to find the perfect jeans, bestdressed, shopping vlog, the hunt for the perfect pair of jeans, finding the perfect jeans, buying the perfect jeans, shopping vlog 2017"
"Come Shopping With Me! Oxford Street, London-gsTxRVPrKdQ",20160616,Howto & Style,131132,1567,95,11431,527,69.13973387,97.62316011,15.07999626,3.489225129,24.15360988,5.99007148,96.42534852,212.0667352,"come shopping with me, come shopping with me 2016, shop with me, shop with me at the mall, shop with me oxford street, come shopping with me oxford street, shopping haul, shopping vlog, shopping vlog 2016, shopping vlog london, shopping vlog oxford street, oxford street shopping, shopping vlog and haul, shopping vlog mall, shopping for clothes vlog, h&m haul 2016, topshop haul 2016, zara haul 2016, shopping at shopshop, shopping at oxford street"
come thrifting with me in london! + try on haul-UXTXFp9SFpg,20191110,Howto & Style,1713731,103599,631,15973,474,58.27843566,113.7444732,25.31211945,9.719236538,30.15387446,16.69219925,54.30455768,118.3493092,"come thrifting with me, come thrift with me, thrift with me, thrift haul, thrift store, goodwill haul, vintage shopping, vintage stores, thrift with me london, thrifting in london, charity shop, try on haul, thrift haul try on, thrift haul 2019, fall thrift haul, thrift haul fall, come thrifting with me 2019, thrifting adventure, thrifting vlog, thrift vlog, thrift store trip, salvation army, goodwill, affordable haul, thrift flip"
COME THRIFTING WITH ME! _ vlog + try on haul 2017-q0VH1MBMYLE,20171005,Howto & Style,620754,15123,219,26759,839,57.54292879,115.0421358,25.5315351,5.72681144,15.86713511,9.938405326,70.1284884,146.7924306,"come thrifting with me, come thrifting with me 2017, come thrifting with me goodwill, come thrifting with me vlog, come thrifting with me los angeles, come thrifting with me la, come thrifting with me try on haul, thrift haul, thrift store haul, thrift haul try on, thrift haul 2017, thrift haul try on 2017, goodwill haul, goodwill haul 2017, goodwill haul try on, try on thrift haul, try on thrift haul fall, try on thrift haul 2017, thrift vlog 2017, thrift haul vintage"
come thrifting with me! + mini try on haul-CGjAxy8qM4Q,20180111,Howto & Style,119472,4833,44,7701,169,71.87794141,160.9652087,5.98884359,1.227992819,7.390506078,3.700662221,87.71555549,142.1743641,"come thrifting with me, come thrifting with me 2018, come thrifting with me goodwill, thrift haul, thrift vlog, thrift with me, come shopping with me, come thrifting with me vlog, come thrifting with me try on haul, thrift haul try on, thrift haul 2018, try on thrift haul, thrift haul goodwill, thrift store, thrift shop, thrift store haul, thrift store haul 2018, come shopping with me vlog, thrift store vlog, thrifting vlog, bestdressed, goodwill vlog, goodwill haul"
"Come Thrifting with Me! Austin, Texas-DChiS3FZrxQ",20170715,Howto & Style,153654,4027,50,12215,134,56.02336183,68.75972181,31.42099952,21.18026178,47.70167156,42.04135205,98.23575425,211.7624158,"come shopping with me, come thrifting with me, thrifting with me, come thrifting with me 2017, come thrifting with me summer 2017, thrifting haul 2017, thrifting with me 2017, thrifting haul, thrifting tips, thrifting in austin, thrifting in texas, thrift shopping vlog, thrift shopping haul, thrift shopping tips, thrifting vlog, thring shopping vlog 2017, thrift shopping vlog austin, come shopping with me 2017, shopping vlog"
Come Thrifting with Me! Downtown Philly-U14LC3QfFso,20170209,Howto & Style,106226,2555,51,10674,221,83.9668281,128.3826475,9.859435426,1.852016854,54.08516167,14.92909684,73.25353073,176.3381973,"come thrifting with me, thrifting with me, come thrifting with me 2016, come thrifting with me 2017, thrifting with me 2017, thrifting haul, thrifting haul 2017, thrifting tips, thrifting in philly, thrifting in philadelphia, thrift shopping vlog, thrift shopping haul, thrift shopping tips, thrift shopping vlog 2017, thrift shopping vlog philly, thrifting vlog, come thrift shopping with me, come shopping with me, come shopping with me philadelphia"
COME THRIFTING WITH US! at the rose bowl flea market-8YC_KkYl3zM,20181121,Howto & Style,836764,40657,516,10597,620,58.30396168,94.48277957,19.03966019,5.325998752,27.98335827,13.01347511,68.86918002,152.410947,"come thrifting with me, come thrifting with us, thrift with me, thrifting vlog, thrifting in LA, rose bowl flea market, flea market, rose bowl, rose bowl flea market vlog, come shopping with me, shopping vlog, thrift store, thrifting, thrift store vlog, thrift shop haul, thrift haul, come thrifting with me 2018, come thrifting with me fall, come thrifting with me goodwill, rose bowl 2018, thrift shops in LA, bestdressed boyfriend, fall thrifting, fall thrift haul"
cutting my own bangs at 2am,20190207,Howto & Style,2061314,93673,927,8912,162,30.34091021,86.96912435,6.992007876,5.92157688,83.79372508,67.5550087,49.4111521,145.6946821,"cutting my own bangs, i cut my own bangs, how to cut your own bangs, how to cut your bangs, how i cut my bangs, cutting my bangs wispy, cutting my bangs at 3am, cutting my bangs at home, cutting my bangs aesthetic, cutting my bangs success, how to cut your fringe, i cut my bangs, new hair, hair transformation, my hair journey, aesthetic bangs, wispy bangs, how to style bangs, cutting my own fringe, cutting my bangs, cutting my bangs at 2am, cutting my bangs fail"
