Name,upload_date,category,view_count,like_count,dislike_count,frames,number_shots,dark_perc_std,dark_perc_mean,saturated_perc_std,saturated_perc_mean,red_perc_std,red_perc_mean,white_perc_std,white_perc_mean,tags
NYC APARTMENT HUNTING (w_ rent prices + tips!)-K0n-264CETA,20200308,Howto & Style,2752668,183483,1273,34815,647,47.07766796,110.7505901,2.495698023,0.63452137,31.07477966,25.06725095,56.03774411,128.5542368,"nyc apartment hunting, apartment hunting on a budget, new york apartment hunting, sweet digs, nyc apartment tour, nyc apartment hunting cheap, nyc apartment, living in nyc, how to find an apartment, apartment hunting vlog, apartment tour, empty apartment tour, apartment hunting tips, nyc apartment hunting manhattan, nyc apartment tour studio, living in manhattan, what $2000 will get you in nyc, nyc neighborhoods, cost to live in nyc, east village, greenwich village, brooklyn"
October Favorites 2015 _ Fashion & Drugstore Makeup-SoPlZDw5wwE,20151103,Howto & Style,8963,383,4,10795,34,9.710121526,29.78059369,7.966150513,17.97731458,9.411363641,18.00705955,3.968129363,15.41457392,"october favorites, fashion favorites, drugstore favorites, drugstore concealer, drugstore foundation, brandy melville, october favorites 2015, makeup favorites, favorite shoes, favorite food, fall favorites, fall favorites 2015, affordable favorites, hailey jacket brandy melville"
OFFICE LOOKBOOK _ outfit ideas for work + internships-pbbXKSplsEg,20191107,Howto & Style,837261,79197,2807,6102,105,68.10522781,104.0073164,0.159895334,0.032794273,7.520179993,1.746930585,70.8198304,184.1588018,"lookbook, professional lookbook, office lookbook, outfits of the week, business casual, business casual outfits, what to wear to work, work outfits, outfit ideas, outfit ideas for work, outfit ideas 2019, what to wear to interview, business casual outfit ideas, outfit 101, wardrobe basics, professional outfits for women, workwear lookbook, 9 to 5, 9 to 5 outfits, professional outfits, ootw, ootw work, office outfits, what to wear to the office, outfits for work"
oops! i moved to NYC!-7yUM_LlJhLM,20200206,Howto & Style,2542200,221832,687,27248,562,111.3326188,161.3747843,6.399286932,1.582828474,20.49186926,9.595032907,87.46691714,133.2266848,"i moved to NYC, why i'm leaving LA, why i left LA, moving vlog, moving to NYC, moving to nyc alone, moving to nyc by yourself, living in nyc, nyc vlog, LA vlog, moving across the country, moving out, apartment hunt, apartment tour, selling my car, packing, packing for a move, how i moved to nyc by myself, i moved, living alone diaries, my last week in LA, vlogmas, moving vlog first apartment, moving vlog 2020, moving vlog packing"
OOTW _ Senior Events + Last Week of High School-qfefLKTpL4c,20160601,Howto & Style,17925,490,6,9680,74,47.64848567,66.96511051,68.45676005,134.3263241,25.45273402,61.1338141,53.66484076,79.43023181,"outfit ideas for school, outifts of the week, outfits for summer, outfits of the week 2016, outfits of the week for school 2016, outfits of the week high school, high school outfits of the week, outfits of the week spring 2016, ootw last week of school, ootd high school, high school outfit ideas, outfits of the week summer 2016, ootw may 2016, ootw end of school, senior events outfit ideas, cute high school outfits, school outfits 2016, high school ootw"
organizing my hot mess of a closet-_eLp4-DkbFI,20180920,Howto & Style,1363507,75967,450,12991,366,53.16309285,97.41698733,18.4144731,4.807513628,11.11457758,12.56658249,59.62843774,200.1748236,"organizing my closet, closet organization, organizing closet, oragnizing my closet 2018, organizing my closet small, organizing my closet hacks, organizing my closet by color, organizing my closet time lapse, organizing my closet college, small closet organization, cleaning my closet, cleaning my closet 2018, cleaning my closet time lapse, cleaning my closet out, closet tour 2018, small closet tour, small closet organization ideas, small closet makeover, closet makeover"
our first road trip together...-ios8B3UDgjU,20190613,Howto & Style,1092636,70699,313,17854,832,83.01352826,136.6092077,13.91977178,6.512690341,32.15759365,17.55787838,83.82682018,120.4547901,"we travelled across the country together, our first road trip, pack yourself a toothbrush dear, san fransisco, california road trip, road trip vlog, we went on vacation, going on a trip by myself, spring break trip, summer vacation, vacation vlog, san franscisco vlog, come thrifting with me, thrifting, bestdressed thrifting, guide to san francisco, things to do in san francisco, travel vlog, driving vlog, los angeles to san fransisco, summer road trip, sleep on the floor"
outfits for hot af summer days (ft. me being sweaty)-HbUeaQ2BP-U,20180719,Howto & Style,1146480,45810,416,11101,159,19.73811152,40.85255799,5.014631033,1.005118313,9.418260617,9.425151983,33.23240328,287.7929386,"outfits for hot weather, hot weather outfits, outfit ideas summer 2018, summer outfit ideas, outfit ideas summer, outfits for summer, casual summer outfits, casual outfit ideas, festival outfits, summer lookbook, outfits for hot days, outfits for hot summer days, cute outfits for hot days, outfits for hot school days, summer lookbook 2018, summer outfit inspo, outfit ideas for hot days, summer vacation outfits"
Outfits of the Week - College Edition _ Spring 2017-S4yxixqXDxs,20170428,Howto & Style,36133,1169,4,7077,97,45.24182579,102.4380558,2.650181227,1.896475438,13.46305753,23.2846269,88.44162948,129.0630881,"outfits of the week, outfits of the week 2017, outfits of the week for school, outfits of the week spring, outfits of the week spring 2017, ootw college, ootw 2017, ootw spring 2017, ootw school, ootd school, ootd 2017, college outfits of the week, college outfits 2017, college outfits spring 2017, college outfit ideas, school outfit ideas, school outfits 2017, school outfits, outfits for school, outfit ideas for school, outfit ideas for spring, outfit ideas 2017"
Outfits of the Week for High School _ Winter 2015-2016-H7L3wdhKk3E,20160109,Howto & Style,27591,721,4,5828,63,14.04562941,29.23899282,14.16717506,15.57847609,12.20493461,14.45797688,13.14460581,23.08566103,"high school outfits of the week, high school outfits, high school outfit ideas, high school outfits 2016, outfit ideas, outfit of the week, outfits of the week, ootw, outfit ideas for school, outfit ideas for winter, outfits for school, outfits for winter, outfits for winter 2016, ootw 2016, ootw winter 2016, outfit ideas for high school, outfit ideas for high school winter, winter outfit ideas, winter outfits 2015, winter outfits 2016, outfits for winter 2015"
painting for the first time in 4 years...-v1Xyz9QzHoM,20191114,Howto & Style,1302249,106340,377,27907,568,43.12225513,95.09736434,2.37068765,0.499989068,18.50449843,7.378096441,51.02550079,194.2068302,"following a bob ross tutorial, painting timelapse, art timelapse, bob ross tutorial, paint with me, painting for 24 hours, painting for the first time in 5 years, art school, oil painting, oil painting timelapse, painting for beginners, ex dancer, ex dancer tries ballet, art portfolio, reviewing my old portfolio, reviewing my old art, painting tutorial, painting a self portrait, art school vlog, draw with me, art student portfolio"
Paris Outfit Diaries-4kc5JkjRnuQ,20161117,Howto & Style,14542,553,4,4845,78,48.98376671,80.60228312,3.652065753,0.528099929,5.594438956,1.404991271,57.5790833,262.9179761,"paris outfit diaries, paris what i wore, what i wore paris, paris outfits, paris lookbook, paris winter outfits, paris summer outfits, paris fall outfits, paris outfit ideas, paris outfit ideas 2016, paris what i wore 2016, what i wore paris 2016, paris outfit diaries 2016, outfit diaries july, outfit diaries travel, bestdressed, paris fashion, what i wore in paris, what i wore in paris 2016, ootw paris, ootw paris 2016, paris lookbook 2016, modelcitizen"
plan with me setting up my first bullet journal!-i1rn-mhNElQ,20191103,Howto & Style,936347,72108,270,20155,258,79.27787192,43.63285338,12.09279296,3.726920307,13.65694111,10.30001825,74.56828007,182.7007905,"bullet journal, bujo, bullet journal setup, bullet journal setup 2019, bullet journal setup 2020, practical bullet journal, minimal bullet journal, november bullet journal, plan with me, bullet journal flipthrough, planner setup, how i stay organized, bullet journal timelapse, bullet journal flip through, bullet journal beginners, bullet journal minimalist, bullet journal for students, bullet journal for college, bullet journal ideas, productive day in my life"
preparing to make 2020 my b_tch-Es3RnyhX9Y4,20200102,Howto & Style,1470518,111635,811,24956,368,75.72574824,97.93940611,39.18227253,17.31631982,47.18288079,23.74416352,104.0564059,145.4483905,"2020 resolutions, new years reset, new years routine, reviewing my decade, reflecting on 2019, my year in review, my year in 5 minutes, NYE, grwm, grwm for new years, vlogmas, new years outfit, new years resolutions, bullet journal, bullet journal 2020, bullet journal setup 2020, productive day in my life, how i stay productive, productivity tips, my favorite movies, best movies 2019, cleaning my apartment, productive sunday, organizing my apartment, cleaning my bedroom, 2020"
PROM DRESSES FOR UNDER 30,20180419,Howto & Style,745235,23811,206,16283,195,30.42636989,39.66299993,1.726365954,0.274718277,2.759879114,2.056069614,50.37086267,280.1025554,"prom dress shopping, prom dress try on, prom dress shopping online, prom dress haul, affordable prom dresses, thrifted prom dress, affordable prom dresses 2018, affordable prom dresses online, diy prom dress, diy prom dress no sew, cheap prom dresses, cheap prom dresses online, cheap prom dress haul, where to buy cheap prom dresses, prom look, prom lookbook, prom lookbook 2018, prom dress thrift store, prom dress thrifted transformation"
"Q+A _ college decisions, confidence, my first kiss lol-yttmkiXFvR8",20180125,Howto & Style,222876,9712,42,17996,91,24.41417236,71.56857043,0.280923051,0.074997194,1.722274877,1.31566358,36.26055656,273.0431103,"q&a video, q&a life, college q&a, college q and a, q and a, q+a, q+a college, my college decision, my college decisions process, how to be confident, my first kiss story, first kiss, first kiss storytime, ucla, what is ucla life, applying to film school, film school application, ucla film school, my college decision 2018, how i got into stanford, how i got into columbia, accepted to stanford, accepted to columbia, how to get into an ivy, stanford application, bestdressed"
QUICK + EASY HEATLESS CURLS (that actually look good)-rhWnr06T-oY,20170817,Howto & Style,71189,2617,18,8093,71,24.92934138,42.63568207,25.61338946,3.292875898,4.834249798,0.871598447,44.50121247,288.3842153,"heatless curls, heatless curls that last all day, heatless curls for short hair, heatless curls for medium hair, heatless curls overnight, heatless waves, heatless curls overnight for medium hair, hearless waves overnight, easy heatless curls, easy heatless waves, quick heatless curls, easy heatless curls in 5 minutes, heatless curl tutorial, best heatless curls, how to style a lob no heat, how to style a lob heatless"
reading people's assumptions about me _sPicY-tAe2CaBO3hI,20190203,Howto & Style,2009368,113483,501,21826,155,12.31108793,93.26623176,0.307674113,0.062855406,2.116908776,0.864132061,53.60374418,207.0590196,"reading people's assumptions about me, reading assumptions about me, best dressed sexuality, reading yout assumptions about me, my subscribers bully me, reading hate comments, letting my subscribers bully me, reacting to hate comments, assumptions, instagram q and a, best dressed q and a, personal q and a, spicy q and a, reading peoples assumptions, reading peoples assumptions 2019, reacting to your assumptions, what you assumed about me"
"real talk about breakups, boys, and blowjobs lol-U4mQQc2XUOk",20190829,Howto & Style,2145623,176662,691,36957,155,46.73256756,107.4589023,2.372011782,2.440094484,5.870609955,12.09616455,10.81973313,2.625111045,"girl talk, how to get over a breakup, best dressed boyfriend, heartbreak, sex Q + A, sex q+a, casual dating, hookup culture, making friends after college, how to make friends, lonliness, commitment, how to heal after a breakup, crush, age gaps, nudes, age gap relationship, dating, dating advice, relationship advice, sex advice, oral sex, girl talk sex, life update, all the tea you need to know about me, personal q+a"
reviewing my _iconic_ middle school outfits-kKkjTbt9ArQ,20190726,Howto & Style,1439032,87604,487,15111,166,44.33926932,92.5576264,18.83755503,4.297795351,33.97804621,15.88507586,61.80671724,188.5239077,"my style evolution, fashion evolution, style evolution, i dressed like the 2000s, i dressed like the 2010s, i dressed like 2008, i dressed like 2010, 2000s, 2010s, fashion review, fashion week review, runway review, outfits for school, my middle school experience, glo up, my glo up, glow up, how to find your style, my hair journey, my style journey, my fashion journey, hair evolution, met gala review, oscars review"
ROOM TOUR (styling a small bedroom)-QOyVhZGrX6Q,20180426,Howto & Style,309741,13204,70,6866,140,75.048015,85.00693895,77.95119243,51.91072683,91.59840083,75.46436832,105.5698858,109.879593,"colorful room tour, room tour, colorful room decor, colorful room makeover, childhood bedroom, bedroom tour, bedroom makeover, colorful room tour 2018, colorful room tour 2017, room tour 2018, small bedroom tour, bedroom tour minimalist, bedroom tour small, room tour aesthetic, room tour artsy, room tour kids, room tour colorful, room tour tumblr, room tour 2018 tumblr, room tour 2018 kids, room tour 2018 teenager, bedroom tour small room, bedroom tour artsy"
ROOM TOUR _ my tiny college apartment in LA-d-cKzEKyK9I,20171207,Howto & Style,310873,9069,77,12855,232,52.06928733,94.5861524,3.637615484,1.076930865,4.969652014,2.952593943,70.03773691,239.1602424,"room tour, room tour 2017, room tour aesthetic, room tour tumblr, room tour 2017 tumblr, room tour lights, room tour white, room tour white and gold, room tour college, room tour college apartment, room tour college dorm, apartment tour, apartment tour 2017, apartment tour los angeles, apartment tour la, tiny apartment, tiny apartment tour, tiny apartment tour la, tiny apartment tour los angeles, college room tour, college room tour 2017, college apartment tour"
SCHOOL OUTFIT IDEAS 2017-18 _ First Week of School-ms-qa4YxBeg,20170803,Howto & Style,75115,2391,8,8591,88,20.80518931,18.32032556,0.233409284,0.042892958,0.099156789,0.016741153,27.92076381,347.5706707,"school outfit ideas 2017, ootw first week of school, ootw first week of high school, ootw first week of college, ootw first week of school 2017, school outfits, school outfit ideas for high school, school outfit ideas summer, outfit ideas 2017, school lookbook, school lookbook 2017, school lookbook summer, cute school outfits, cute school outfits 2017, cute school outfit ideas, cute school outfits for high school, first day of school, cute school outfits for summer"
"Shoe Collection 2016 _ Boots, Flats, Heels, & Sneakers-7gKZuHatb8k",20160128,Howto & Style,115742,1802,38,14038,56,24.09736519,56.5540229,0.594919994,0.326225008,5.421893855,9.815297145,45.70904685,191.6714173,"shoe collection, shoe collection 2016, shoe collection girls, shoe collection heels, shoe collection flats, shoe collection sneakers, shoe collection on feet, try on shoe collection shoe collection try on, shoe collection boots, my shoe collection, shoe collection 2015, heels collection, boots collection, sneakers collection, flats collection, huge shoe collection, shoe collection try on, shoe collection school, my shoe collection 2016, shoe collection womens"
SPRING _ SUMMER LOOKBOOK 2018-SUmKehi_9hI,20180511,Howto & Style,187370,6962,69,3860,117,60.85258694,60.87700417,13.33821758,4.0613142,11.37309269,4.882769494,106.9573827,216.4556277,"summer lookbook 2018, spring lookbook 2018, outfit ideas summer, outfit ideas summer 2018, outfit ideas spring 2018, spring outfit ideas, spring trends, gingham dress, how to style gingham, casual outfit ideas, outfit ideas spring, lookbook 2018, lookbook spring 2018, summer outfits, casual spring outfits, casual summer outfits, outfits for spring, outfits for school, summer lookbook, spring lookbook, spring summer lookbook, LA lookbook, LA outfits"
spring cleaning my closet! -esTFzXCH1Xc,20180524,Howto & Style,522457,16407,117,14027,303,44.8446936,73.46560873,4.411472077,2.038700144,7.690297031,5.224829054,64.39578269,255.4309282,"spring cleaning 2018, spring cleaning my room, spriong cleaning routine, spring cleaning tips, organizing my closet, organizing my closet small, organizing my closet 2018, organizing my closet by color, cleaning my closet, cleaning my closet timelapse, cleaning my closet 2018, cleaning my closet and room, cleaning my closet out, cleaninbg my room, organizing my room, cleaning my room college, closet organization tips, capsule wardrobe, minimalism"
"Spring Try On Haul 2016 Brandy Melville, A&F, F21, AE-tLCnbPltqLc",20160422,Howto & Style,16758,533,5,17359,123,30.45004143,48.51751175,34.74936586,39.27077883,52.4261218,88.53976667,82.21711887,171.1617252,"spring haul 2016, spring haul 2016 try on, spring haul 2016 forever 21, spring haul forever 21, brandy melville haul, forever 21 haul, american eagle haul, abercrombie haul, brandy meilville haul 2016, brandy melville try on haul, brandy melville try on haul 2016, brandy melville try on haul spring 2016, forever 21 try on haul 2016, forever 21 try on haul spring 2016, try on clothing haul, spring clothing haul, spring try on haul, try on haul forever 21"
"STARTING AN ONLINE BUSINESS _ photography, modeling, thrifting, website design-c12qIxR2QOA",20180228,Howto & Style,277720,11646,114,21437,463,57.85003806,93.69934091,9.528760237,1.412387564,7.778534688,2.131600588,76.21007421,239.7887327,"starting a business, starting an online business, starting an online store, starting a clothing line, starting an online boutique, starting an online clothing business, starting an online business with no money, starting an online clothing boutique, starting an online shop, starting an online business for dummies, starting a business from scratch, starting a business in college, starting a business as a teenager, starting a business at 19, how to start a business"
STYLING BASICS _ 5 PIECES 15 OUTFITS-FQGnGketNbs,20170921,Howto & Style,283576,12081,81,16792,121,37.71834073,54.90627058,12.84528082,0.899990061,2.529614715,0.847921093,44.61508677,297.1781732,"styling basics, styling basic clothes, 5 pieces 10 outfits, basics mashup, how to style basics, how to style basic clothes, how to style basic outfits, how to style basics and essentials, wardrobe essentials, wardrobe basics, closet essentials, closet basics, basics mix and match, basic outfits, basic outfit ideas, basic outfits for school, how to style basics for fall, how i style basics, styling basics fall 2017"
SUMMER LOOKBOOK (lots o’ outfit ideas)-Mow45NRck0M,20190516,Howto & Style,1711492,127118,406,10552,229,59.62047476,192.3741026,12.56243935,3.819512172,15.16527133,10.04085394,64.39472366,91.42926148,"summer lookbook, summer lookbook 2019, summer outfit ideas, casual outfit ideas, spring outfit ideas, outfits of the week, outfits of the week college, ootw, outfit ideas, lookbook, outfit ideas summer, outfit ideas 2019, how to style a midi skirt, colorful outfits, how to style color, summer ootw, summer outfits, everyday outfit ideas, every day outfit ideas, outfit inspo, lookbook 2019, la lookbook, aesthetic lookbook, retro lookbook, 90's lookbook, 70's lookbook"
summer outfits of the week _warning - v cute-nYYu0zsrmck,20190630,Howto & Style,1005067,79147,301,7642,44,36.57984412,157.5609167,4.778781602,2.616983325,10.4986628,8.114815483,35.09434926,134.4765512,"ootw, ootw summer, summer outfits, summer outfit ideas, outfit ideas, outfit ideas 2019, ootw college, casual ootw, casual summer outfit ideas, easy summer outfit ideas, casual outfit ideas 2019, 50 outfit ideas, outfit of the week, outfit of the week summer, what i wore this week, what i've been wearing, my week in outfits, outfit of the day, ootd, outfit of the day summer, fashion, summer lookbook, summer fashion, summer trends, 2019 trends, outfits for summer"
SUMMER TO FALL LOOKBOOK 2017 _ transitional outfits-I45sNNtPuyM,20170914,Howto & Style,36237,1736,11,4915,111,70.61762402,91.37578529,1.196914031,0.536118297,7.455790646,3.377586844,100.4243742,217.3318654,"summer to fall outfits, summer to fall transition outfits, summer to fall transition lookbook, summer to fall transition outfits 2017, summer to fall transition 2017, transitional lookbook, early fall lookbook, early fall outfits, early fall loobook 2017, late summer lookbook, late summer loobook 2017, fall lookbook, fall lookbook 2017, fall outfits 2017, fall outfit ideas, fall outfit lookbook, fall outfits of the week"
summer try-on thrift haul -pjfayLVVObc,20190523,Howto & Style,1399300,96233,620,16207,181,32.50850338,36.4965722,7.099006801,1.85927173,12.6886641,14.3737249,62.37495027,139.7607448,"summer thrift haul, thrift haul, try on thrift haul, thrift store haul, affordable haul, clothing haul, summer clothing haul, summer haul, thrift haul 2019, thrift haul try on, thred up haul, online thift haul, thrift haul goodwill, thrift haul salvation army, 90s thrift haul, 80s thrift haul, 2000s thrift haul, depop haul, sustainable haul, thrift haul best dressed, come thrifting with me, thrift with me, spicy thrift haul, spring thrift haul"
"SUSTAINABLE HAUL reformation, re_done, vintage-Wvp50gSvVNw",20181108,Howto & Style,908665,42652,244,19548,255,29.2309355,54.61499482,5.528808011,7.284127169,5.177811073,8.533677804,65.03445264,221.1334447,"fall haul, fall haul 2018, winter haul, winter haul 2018, sustainable haul, susatianable clothing haul, sustainable fashion, zero waste, fast fashion, quitting fast fashion, try on haul, try on haul 2018, vintage, reformation haul, reformation, jeans haul, try on clothing haul, ethical fashion brands, ethical fashion, ethical clothing, ethical clothing haul, sustainable brands, everlane, clothing haul, sustainable clothing, redone jeans, the real real, try on fall haul"
taking everyone i love on dates  -)-qZ-RxlGagwU,20190117,Howto & Style,878702,84998,154,15713,263,102.4615793,165.5884095,10.52814048,7.694152081,20.46872139,11.2823303,81.53728547,120.4400847,"lookbook, date night lookbook, going out lookbook, revolve, nighttime lookbook, clubbing lookbook, what to wear on a first date, what to wear on a date, date vlog, date night vlog, best dressed boyfriend, date night vlogbook, ootw, college ootw, la vlog, self care, self care tips, girls night out, girls night out lookbook, self care day, taking myself on a date, taking myself on a date vlog, outfits of the week, date night lookbook 2019, valentines day lookbook"
taking myself on a date -PIZIB8XdtqY,20190808,Howto & Style,1884459,143769,876,21754,757,78.4496025,155.7879326,5.954905047,2.786745932,20.50862914,13.88099397,74.16058429,138.513046,"having fun by myself, having fun by myself emma chamberlain, self care day, self care sunday, concert vlog, taking everyone i love on dates, taking myself on a date, taking myself on a lunch date, how to have a fun night alone, how to have fun when you haven no friends, how to have a fun night when you have no freinds, how to go out by yourself, date ideas, day in my life, plant shopping, i made myself dinner, cooking myself dinner"
talkin bout body image _ a journey down the fitness rabbithole-kao2Kgoho98,20171230,Howto & Style,188444,8033,30,8572,21,9.249507498,28.85711427,0.03947788,0.008293895,1.514981059,2.65359304,23.50834875,308.7333504,"body image, my fitness journey, fitness journey before and after, freshman 15, body image and self confidence, body image talk, mental health, eating disorder, eating disorder story, body image and the media, body image issues, social media body image, toxic fitness culture, how to stay fit, how to lose weight, how to get fit 2018, fitness motivation, fitness culture, dieting culture, mental health awareness, eating disorder awareness, freshman 15 story, bestdressed"
Talking Shit About Spring Trends-zPOJ4rCCj_c,20170420,Howto & Style,15891,602,3,19670,131,33.13227749,98.23201325,6.852077883,10.95981909,8.726587421,20.79049757,64.93121519,159.5362781,"trends spring summer 2017, spring trends, spring trends 2017, spring fashion 2017, spring fashion 2017 women, spring fashion trends 2017, spring fashion trends, trend report 2017, hot spring trends, hot spring trends 2017, spring fashion runway, spring summer 2017, spring summer 2017 fashion trends, spring summer 2017 fashion, spring summer 2017 trends, bestdressed"
THE _sickest_ THRIFT HAUL EVER-34QE6DCGl5Q,20181220,Howto & Style,2342151,80352,774,17459,285,55.1047804,105.8518816,9.540847456,2.943297819,3.049977879,2.533927318,44.07554716,218.8337676,"thrift haul, thrift haul 2018, thrift haul 2019, try on thirft haul, thrift store haul, thrifting, thrift haul goodwill, goodwill haul, winter thrift haul, thrift haul try on, winter try on thrift haul, thrift haul vintage, la thrift haul, thrift haul winter 2018, thrift haul winter 2019, huge thrift haul, $100 thrift haul, thrift flip, thrift shopping, thrift haul vintage dresses, winter try on haul, clothing haul, affordable clothing haul, winter haul"
