Name,upload_date,category,view_count,like_count,dislike_count,frames,number_shots,dark_perc_std,dark_perc_mean,saturated_perc_std,saturated_perc_mean,red_perc_std,red_perc_mean,white_perc_std,white_perc_mean,tags
How to Dress Well on a Budget!-AzhckfWiqfw,20170518,Howto & Style,116425,4434,27,14436,88,61.82296802,171.4053723,0.634094988,0.234673576,2.528911845,3.806641451,91.05499222,126.4218593,"how to look cute on a budget, how to look good on a budget, how to look expensive, how to look expensive on a budget, how to look expensive with cheap clothes, how to look expensive for less, how to look expnesive and slay on a budget, how to dress well on a budget, how to dress well on a budget women, how to dress well on a tight budget, how to dress well in college, how to dress well as a student, how to be fashionable on a budget, how to dress cute on a budget"
how to edit youtube videos LiKE A pRo-u5QMR0IwaNY,20180705,Howto & Style,2117052,120806,1980,20068,320,109.5385142,115.4176949,5.876599925,1.014871795,3.725611698,1.898023828,108.1885131,225.7173906,"how to edit youtube videos, how to edit videos for youtube, how to edit like emma chamberlain, how to edit on final cut pro x, how to edit youtube videos 2018, how to edit videos for youtube 2018, how i edit my videos, how i edit my youtube videos, how to edit videos, how to edit fashion videos, how to edit vlogs, how to edit vlogs on final cut pro, how to find music for youtube videos, how to find copyright free music, how to find background music"
how to find your style + the confidence to wear it-kUE2fPLOUxo,20190711,Howto & Style,2153380,158941,715,20761,215,40.48406385,111.4938138,2.551889235,0.602758933,5.341424307,10.66502462,35.67186042,174.0397746,"how to find your style, how to find your aesthetic, how to build your wardrobe, outfit ideas, how to be more confident, how to be confident, how to dress aesthetic, how to dress baddie, how to improve your style, how to make your basic clothes look cute, fashion 101, outfit 101, confidence tips, how to wear what you want, how to wear whatever you want with confidence, how to dress well, find my style, fashion inspo, outfit inspo, style inspo, shopping tips"
How to Get a Job at American Eagle--VYeHFvj4LY,20151022,Howto & Style,66547,1552,13,16192,16,24.64966822,91.57057983,6.65302096,70.10199214,9.326170339,92.81504483,6.213249538,76.05959139,"American Eagle Outfitters (Business Operation), Job (Quotation Subject), Retail (Industry), sales associate, aeo sales associate, how to get a job at american eagle, how to work at american eagle, working at ae, how to get a job in retail, working at american eagle, how to get hired at american eagle, how to become an american eagel sales associate, how to get a job at ae, american eagle interview, american eagle job application"
how to look cute when ur an emotional wreck -eKUZ3KQCfJc,20181206,Howto & Style,1020816,67871,233,7209,71,17.15015915,28.90811246,16.50409783,34.47347046,20.59027076,55.07723963,44.52013953,251.5630378,"makeup tutorial, makeup tutorial for beginners, makeup fail, makeup tutorial for hooded eyes, makeup tutorial for asian eyes, grwm, chatty grwm, winter makeup, easy makeup, simple makeup, 5 min makeup, 5 minute makeup, everyday makeup, how i go from a 3 to a 7, glo up, makeup for beginners, quick makeup, my everyday makeup, best dressed makeup, makeup for school, grwm 2018, drugstore makeup, no makeup makeup, how to trick people into thinking you're good looking"
how to look cute when you're out of f_cks-28sHpCt5-jE,20190926,Howto & Style,1792515,137869,495,16227,175,56.64466451,92.86752866,1.769164309,1.367684478,34.96785159,36.97167605,70.99747755,104.2982416,"lazy day outfits, one minute makeup, two minute makeup, how to put together an outfit 101, how to make your basic clothes look cute, how to look cute with no effort, how to look hot with no effort, simple outfit ideas, casual outfit ideas, outfit ideas for school, outfits for school, comfy outfits, comfy outfits for school, heatless hairstyles, messy bun, easy hairstyles, hairstyles for school, outfit ideas, lazy day outfit ideas, lazy day outfits with leggings"
how to put together an outfit 101 - winter edition-bSMh0z2eA54,20181115,Howto & Style,1981914,95538,770,21197,275,31.49632049,86.46007941,2.27423801,1.817144968,6.979819053,10.94298426,52.09296788,232.6403626,"outfit 101, outfit basics, styling basics, styling tips, fall outfit ideas, winter outfit ideas, winter outfit idea 2018, how to dress for cold weather, how to dress warm and cute, outfit ideas, how to style, outfit ideas for winter, easy outfits, fashion, outfit ideas for school, cute outfit ideas, how to make outfits, how to put together an outfit 101, how to put together an outfit, styling tips every girl should know, cold weather outfits, cozy outfits, how to layer"
how to put together an outfit 101-bWCCIp5pHXk,20181101,Howto & Style,3843336,188126,1792,17839,209,27.89717335,87.00882669,4.683816967,5.018259855,15.15026921,15.43471901,31.32200351,223.2928723,"outfit 101, outfit basics, styling basics, styling tips, fall outfit ideas, fall outfit ideas 2018, winter outfit ideas, winter outfit ideas 2018, simple outfits, outfit ideas, how to style, styling tips for women, styling tips every girl should know, outfit ideas for fall, ootw, easy outfits, bestdressed, ootd, college outfits, fashion, outfit ideas for school, cute outfit ideas, how to make outfits, how to make outfits cute, how to put together an outfit 101"
How to Style a Lob with NO HEAT _ Heatless Waves for Short Hair-Lcn_SVtDpG4,20160212,Howto & Style,43816,1003,13,11708,55,29.72413761,59.23674131,0.611178433,0.232249746,40.06889647,154.0719742,39.0273098,103.4928941,"how to style short hair, how to style short hair no heat, how to style short hair heatless, heatless waves, how to style medium hair, how to style a lob, beachy waves hair tutorial, heatless curls overnight, heatless hairstyles, heatless curls for short hair, heatless waves for short hair, how to style a bob, how to style a lob heatless, how to style a lob no heat, how to style a lob without heat, how to style a lob (no heat & curls)"
How to Style a T-shirt Dress 5 Ways (Original Version)-QACewNNpce4,20150928,Howto & Style,93322,3174,21,3425,37,76.92030208,44.77106632,4.081286996,1.875428391,13.00232987,11.82136093,86.90267139,239.8894375,"T-shirt (Garment), Shirt (Garment), Clothing (Industry), Fashion (Industry), Dress (Industry), t-shirt dress, tshirt dress, outifts, school outfits, how to style, how to style a tshirt dress, Blazer (Garment), brandy melville, flats, Style, Skirt (Industry), model, modelcitizen, model citizen, lookbook, tshirt dress loobook, fall, spring"
How to Style a T-shirt Dress 5 Ways-EJ_o3gGMmgY,20150929,Howto & Style,24000,675,10,3424,32,88.05007289,39.72670154,0.723700429,0.541929714,11.32810256,11.91962031,93.43540796,255.9299242,"T-shirt (Garment), Shirt (Garment), Clothing (Industry), Fashion (Industry), Dress (Industry), t-shirt dress, tshirt dress, tshirt, t shirt, t shirt dress, outifts, outfit, school outfits, school outfit, how to style, how to style a t-shirt dress, how to style a tshirt dress, Blazer (Garment), how to style a t shirt dress, flats, style, skirt, model, modelcitizen, model citizen, lookbook, t shirt dress lookbook, t-shirt dress lookbook"
how to style thrifted clothes-3LN3__G2yGo,20190801,Howto & Style,1696331,123842,558,20794,152,21.08812053,58.91278185,0.530990009,0.22317318,8.11955523,21.77872751,25.26633277,246.7322165,"thrifted outfits, outfit ideas, back to school outfit ideas, outfit 101, how to put together an outfit 101, how to style thrifted clothes, thrift store haul, thrift haul, thrift store outfit, styling 101, styling tips, thrifting tips, how to thrift like a pro, how to thrift like a teen, outfits of the week, casual outfits, sustainable haul, thrift haul try on, outfit ideas 2019, bougie on a budget, look for less, fashion 101, come thrifting with me"
HOW TO THRIFT LIKE A PRO (_actually useful_ thrifting tips)-iXR4AWCH_Sk,20200116,Howto & Style,1722432,120364,604,29970,540,51.70339502,70.44508973,20.78571072,4.240100536,69.20262045,31.30218008,75.69287048,183.7606896,"how to thrift like a pro, how to thrift, thrifting tips, flea market, goodwill, salvation army, depop, thredup, how to shop on thredup, how to thrift like a teen, thrifting and reselling, thrift haul, try on thrift haul, thrift haul 2020, thrifting secrets, thrifting secrets no one will tell you, estate sale, come thrifting with me, guide to thrifting, come thrifting with me 2020, thrift vlog, vintage, where to find thrift stores, where to thrift, online thrifting"
HUGE TRY ON THRIFT HAUL 2017 (designer finds + DIY's)-qMk5z3clFhY,20170901,Howto & Style,461324,15721,171,28810,248,33.31448465,45.38086927,14.00525353,1.542196298,2.952686169,1.031571846,48.18054806,289.8921905,"cheap thrift haul, thrift store haul, thrift store finds, thrift store shopping, thrift haul 2017, thrift haul try on, thrift haul goodwill, thrift haul try on 2017, thrift haul tommy hilfiger, thrift haul salvation army, thrift haul vinatge, thrifting haul, thrifting try on haul, thrifting haul 2017, thrifting haul and try on, thrifted transformation, thrift diy, thrift stroe haul designer, thrift haul for resale, thrift haul for poshmark, thrift haul fall 2017"
I TRIED A CAPSULE WARDROBE FOR 30 DAYS-8dzGsnYKOS4,20191121,Howto & Style,2290616,128741,801,31087,459,75.00963957,107.5685001,1.748214964,0.320326899,12.98122566,4.102941081,88.34196269,168.1613581,"capsule wardrobe, capsule closet, i tried a capsule wardrobe, fall capsule wardrobe, what's on my rack, minimalism, minimalist closet, minimalist wardrobe, 30 outfits, fall outfit ideas, outfit ideas for fall, casual fall outfits, winter outfits, winter outfit ideas, winter capsule wardrobe, i tried a capsule wardrobe for a month, most worn clothing, closet essentials, fall essentials, outfit mashup, small wardrobe, closet basics"
i went to a REFORMATION SAMPLE SALE (vlog + haul)-allPoEqNB4Q,20181018,Howto & Style,647579,27034,125,11210,307,43.19724179,75.49905642,32.65642596,14.27228377,46.33811348,24.10663761,47.50132217,166.802752,"reformation sample sale, come shopping with me, susatinable haul, sustainable clothes, reformation, reformation haul, sample sale, sample sale vlog, sample sale la, los angeles, sample sale experience, sample sale haul, sample sale video, sample sale la dress, come shopping with me 2018, try on haul, clothing haul, try on haul 2018, reformation dress, come shopping with me vlog, shopping vlog and haul, sale haul, fall haul, la vlog"
INSTAGRAM_CELEB INSPIRED OUTFITS-JAbufUOMv-M,20171216,Howto & Style,161551,7008,34,8683,128,36.32577359,44.18831673,20.53403579,5.622380566,3.76274914,1.317010431,65.83728222,297.3128282,"instagram outfit ideas, tumblr outfit ideas, instagram outfit ideas 2017, instagram lookbook, instagram lookbook 2017, extra af lookbook, tumblr outfits, tumblr inspired outfits, tumblr lookbook, tumblr inspired outfits 2017, tumblr inspired winter outfits, instagram inspired outfits, instagram fashion trends, holiday party outfits, holiday outfits, holiday outfit ideas, holiday outfit ideas 2017, celeb street style, celeb style steal, kendall jenner style steal"
JEANS + A TSHIRT _ 3 everyday outfit ideas-JCo-WeiEG30,20180407,Howto & Style,131657,6181,21,5679,110,62.46876275,71.289025,10.37083752,3.999614944,2.528976185,1.572354753,85.30614252,237.9544738,"jeans and a tshirt, jeans and tshirt, jeans and heels, jeans and boots, jeans and heels outfit, jeans and tshirt outfits, jeans and tops for girls, jeans and a nice top, jeans and high heels, everyday outfits, everyday outfit ideas, outfit ideas for school, outfit ideas 2018, casual outfit ideas, easy outfit ideas, simple outfit ideas, no effort outfits, outfit ideas for school 2018, jeans lookbook, spring lookbook 2018, simple outfits with jeans, outfits with jeans"
LAST MINUTE _not lame_ HALLOWEEN COSTUMES-Irgv10cUjak,20171026,Howto & Style,618437,19883,240,12008,140,33.56809451,58.64809713,3.690805788,0.997068751,6.49603988,3.890194028,43.52114268,276.6504523,"last minute halloween costumes, last minute halloween costumes for girls, last minute halloween costumes 2017, last minute halloween costumes for teenage girls, halloween costumes diy, halloween costumes idea, halloween costumes for girls, college halloween costumes, college halloween costume ideas, diy halloween costumes, diy halloween costume ideas, cheap halloween costumes, easy halloween costumes, halloween costume ideas for teenage girls, halloween costume ideas 2017"
LAST MINUTE _not lame_ HALLOWEEN COSTUMES-tFE5VV66F6g,20181025,Howto & Style,943891,37327,840,16515,196,34.13835852,64.77287267,24.52715215,17.64099786,42.9519375,31.53320784,44.22287645,190.4881879,"halloween costumes, halloween costume ideas, cute halloween costumes, last minute halloween costumes, last minute halloween costume ideas, last minute halloween customes 2018, halloween costumes 2018, halloween costumes college, halloween costumes diy, halloween costumes for girls, ariana grande costume, bojack horseman costume, kim possible costume, emma chamberlain costume, turning myself into emma chamberlain, emma chamberlain for a day, margot tenenbaum costume"
LAZY DAY OUTFIT IDEAS-UNFDAiHmyFQ,20180222,Howto & Style,347985,16230,68,6294,174,77.78691383,94.79560285,2.111100041,0.617716851,13.76421309,6.252052269,103.0025926,198.556265,"lazy day outfits ideas, lazy day outfits, lazy day outfits for school, lazy day lookbook, lazy day outftis 2018, simple outfits, simple outfits for school, comfy outftis, comfy outfits for school, comfy outfits for school 2018, comfy outfit ideas, comfy outfti lookbook, how to look cute with no effort, no effort outfits, easy outfits, easy outfits for school, bestdressed, outfit ideas for school, outfits of the week college, outfits of the week, casual outfit ideas"
learning how to dance (w_ haley pham)-7B33Tb-2vlc,20190405,Howto & Style,962287,71398,330,12615,214,26.43092635,86.14872134,0.82048145,0.193233927,5.063501621,5.185283389,35.16538293,236.8579886,"trying to learn to dance, learning to dance, learning to dance in 24 hours, learning to dance in a week, training like a k pop star, training like a professional dancer, training like a ballerina, dance, how to dance, haley pham, haley pham dance, emma chamberlain teaches us how to cheerlead, learn how to dance, becoming a dancer in 24 hours, trying to dance, choreography, dancing, haley pham teaches me to dance, dance basics"
let's catch up  -) a chill + chatty sunday vlog-J7pLfxgfic4,20200202,Howto & Style,1222134,89714,494,23868,541,73.49805943,113.3261636,6.157805836,1.209781484,23.85051864,18.11398091,78.49519828,150.8731479,"productive sunday, day in my life, day in the life, bestdressed vlog, day in my life vlog, day in the life of a youtuber, day in the life of a full time youtuber, working from home, typical day in my life, week in my life, sunday vlog, self care sunday, living alone diaries, LA vlog, vlogmas, living alone in LA, home vlog, what i do in a day, work day in my life, how to make thumbnails, insecurities, body image, bullet journal, productive vlog, productive day"
"life update _ youtube struggles, summer plans, a webseries-cMfn1XlLcJc",20180323,Howto & Style,42059,2442,11,7464,41,33.37184337,120.6281498,0.444548881,0.098712257,1.868408893,4.179106251,72.31399096,117.8347385,"bestdressed, life update, ucla, ucla film school, youtube full time, youtube full time job, starting a webseries, web series, webseries, the truth about youtube, working as a youtuber, life of a youtuber, youtube struggles, how to become a youtuber, college, ucla vlog, college vlog, chatty grwm, vlog, car vlog, chatty update, what i've been up to, best dressed, college stress, feeling overwhelmed, spring break vlog, summer break, summer internship"
"London Try-On Summer Haul _ Topshop, Boots, Charity Shops-mVMIrQrXgmc",20160708,Howto & Style,17362,497,5,10339,66,53.63919635,110.478048,44.17908145,55.1736148,19.42241009,33.22085376,56.02102096,77.19951218,"london haul 2016, london haul beauty, bestdressed, haul try on, haul 2016 try on, haul summer 2016, haul makeup, makeup haul 2016, makeup haul drugstore, topshop haul 2016, topshop try on haul, topshop try on haul 2016, pull and bear haul, boots haul 2016, haul clothing, try on clothing haul, try on clothing haul summer 2016, try on haul summer 2016, london try on haul, summer try on haul, summer try on haul 2016, charity shop haul, charity shop london, thrift store haul"
"losing my v card, masturbation, and other sexual adventures-qE_oqgKk4Lo",20190110,Education,3076225,177083,1559,27467,145,19.31161951,57.25870698,0.130490599,0.009773867,81.25920625,31.50475736,61.35275528,255.5941631,"losing your virginity, sex for the first time, losing my virginity, my first time, my first time story, storytime, losing your v card, how to lose your virginity, sex q & a, losing your v card tips, losing my v card storytime, does sex hurt the first time, does it hurt the first time, casual sex, college hookup culture, girl's guide to tinder, tinder, bumble, dating apps, period sex, masturbation, female masturbation, kinky sex, bdsm, girl talk, girl talk sex, hookups"
Mildly Traumatic Adventures in London-IH4HAClPXrI,20160901,Howto & Style,22759,992,7,19532,771,73.78019101,120.1788909,9.251680496,2.14769769,23.54585357,12.79806182,81.72430732,145.5030429,"travel vlog, summer vacation, summer vacation vlog, summer vacation 2016, travel vlog 2016, travel vlog day 1, travel vlog summer 2016, london vlog, london travel vlog, london vlog 2016, london vlog summer 2016, travel diary, london travel diary, london trip 2016, travel diary 2016, travel diary summer 2016, england vlog, london travel, london travel 2016, europe vlog, europe trip, travel in london, london trip, summer trip, bestdressed, europe vlog 2016"
MY 2017 IN A NUTSHELL -AON6JJr-Knc,20180104,Film & Animation,57267,3770,6,7585,106,79.18995784,50.33166001,1.659544952,0.519882969,6.78236393,6.311532665,81.38544297,288.8386248,"bestdressed, my 2017 in a nutshell, my 2017 in 5 minutes, 2017 in review, the year in review, 2017 vlog, storytime 2017, a look back at 2017, a look back at my year, vlog 2017, 2017 in one video, 2017 in memoriam, 2017 in one minute, vlog college student, college vlog, glo up, glo up videos, adulting, adulting 101, ucla vlog, a day in my life, day in my life 2017, day in my life as a college student, short film, ucla vlogger, college student vlog, ucla film school"
MY BEST THRIFT HAUL YET + how i resell clothes-Ciu_rUZ8uIQ,20180119,Howto & Style,472330,15896,104,26714,343,43.16471058,82.53183357,9.80929834,1.774600753,3.651551878,2.826321666,51.22311548,257.5918366,"cheap thrift haul, thrift store haul, thrift store finds, thrift store shopping, thrift haul 2018, thrift haul try on, thrift haul goodwill, thrift haul try on 2018, thrift haul vintage, thrifting try on haul, thrifting haul 2017, thrifting haul and try on, thrifted transformation, thrift diy, thrift haul for resale, thirft haul for poshmark, thrift haul winter 2018, winter thrift haul, how to resell clothes, how to sell clothes on poshmark, huge thrift haul"
MY COLLEGE EXPERIENCE (ucla film school)-mFC9NXtm9wM,20190430,Howto & Style,1559098,129537,443,18748,391,65.7441733,117.2146576,14.30105557,4.089336711,23.96665656,12.49797896,73.75201184,177.1617092,"ucla film school, film school, day in the life of a college student, ucla vlog, my college experience, college experience, dropping out of school, dropping out of college, is film school worth it, graduating college in 3 years, graduating college early, graduating in 3 years, college vlog, college experience freshman year, college experience out of state, my american college experience, my college experience was trash, usc film school, college expectations vs reality"
my everyday makeup routine (aka the daily glo up)-UW3qsjGtcto,20180209,Howto & Style,466902,21182,81,11331,167,22.94892028,57.30421058,4.597802376,0.477702752,12.50060918,5.31703356,48.66351198,247.1685537,"everyday makeup tutorial, everyday makeup tutorial 2018, glo up routine, glow up routine, makeup tutorial eyeshadow, eyeshadow for small eyelids, naked heat tututorial, makeup for acne scars, makeup for acne, makeup for hooded eyelids, makeup for acne scarred skin, makeup for coverage, instagram makeup, everyday makeup routine, everyday makeup look, smokey eye, smokey eye tutorial for small eyelids, go to makeup look, go to makeup tutorial"
My Eyebrow Routine-CDf6QLfAI_0,20160218,Howto & Style,12036,381,4,4299,54,6.000262465,21.29444912,0.718509951,0.562155116,13.69871021,32.48954826,6.552797178,13.17844533,"cheap eyebrow tutorial, eyebrow turotial for beginners, eyebrow shaping, eyebrow routine, eyebrow tutorial with pencil, eyebrow tutorial for thicker eyebrows, eyebrow tutorial for brunettes, eyebrow tutorial for asians, inexpensive eyebrow tutorial, how to do eyebrows, how to do eyebrows for beginners, how to do eyebrows cheap, simple eyebrow tutorial, easy eyebrow tutorial, brow tutorial, brow routine, brow tutorial for beginners, brow pencil, cheap brow tutorial"
my first time at vidcon!-tfl-bPjydlw,20190919,Howto & Style,594315,45198,237,23592,817,84.03584789,172.425452,15.96729331,5.116544933,47.00982086,19.26447878,78.90501295,117.5879729,"vidcon vlog, vidcon 2019, social anxiety, my struggle with social anxiety, haley pham, ryan trahan, vidcon now, vidcon tiktok, vidcon storytime, storytime, joana ceddia, vidcon 2019 vlog, jade darmawangsa, alex gowon, how to overcome social anxiety, how to make friends, finding love at vidcon, the truth about youtubers, ryan trahan irl, haley pham vlogs, my first vidcon, work day in the life, day in my life, day in my life as a youtuber, day in the life vlog"
my last week in college ever -HozzaixKyQk,20190322,Howto & Style,1231466,72384,227,21530,599,85.74320482,125.4917917,5.434248278,2.548157582,21.67684538,6.647578515,98.97355971,178.8220967,"college vlog, ucla vlog, week in the life of a film student, day in thelfe of a film student, ucla film school, ucla tft, film school, ucla, week in my life ucla, week in the life of a college student, film school vlog, work day in my life, work week in my life, week in my life la, la vlog, living in la, going to film school, my college experience, best dressed ucla"
my last weekend in LA...-IJcJEMAOJA4,20191024,Howto & Style,1182742,96186,440,31135,1017,76.53679154,190.0158925,15.14134062,2.838244111,35.43311871,15.6174759,48.97658609,68.2993161,"week in my life vlog, week in my life, week in my life LA, week in my life as a youtuber, work week in my life, weekend in my life, day in my life, day in my life vlog, vsco fall, why i'm leaving LA, moving vlog, why i left LA, packing for a trip, bestdressed vlog, bestdressed boyfriend, living alone diaries, living alone in LA, moving to nyc, vlog, week in the life of a youtuber, week in the life, weekly vlog, daily vlog, preparing for fall"
my most worn clothing of 2019 -wO0gV7SRXeM,20200110,Howto & Style,1650157,101199,548,34107,337,27.63666498,47.34980247,9.793403001,2.672178531,33.22007668,41.66850752,99.74921884,126.1618384,"most worn clothing, closet essentials, wardrobe essentials, closet basics, wardrobe basics, clothing haul, rehaul, try on haul, try on, trying on everything in my closet, trying on all my clothes, my closet staples, 2019 favorites, best of 2019, basics mashup, how to put together an outfit 101, closet essentials 2020, winter essentials, fall essentials, perfect pair of jeans, denim guide, straight jeans, high waisted jeans, favorite jeans, shoe collection, best jeans"
MY SHOE COLLECTION-ZkmETpMdv_8,20190606,Howto & Style,1522440,81626,422,20683,100,28.49364188,52.18726562,14.0614119,35.09412362,64.9840125,134.1821647,59.88743948,109.6017208,"shoe collection, shoe collection 2019, updated shoe collection, try on shoe collection, sneaker collection, heels collection, designer shoe collection, trying on everything, trying on all my shoes, trying on all my clothes, dr martens, converse, how to style dr martens, doc martens, fila disruptors, nike air force one, birkenstocks, all my shoes, shoe collection women, my shoe collection, sneaker colleciton 2019, huge shoe collection, shoe collection heels"
My Week In Outfits (fall ootw + stories from my life)-J4DviH8BFeA,20180906,Howto & Style,563334,34532,121,8001,109,44.35697544,58.04495921,29.12611538,7.576531339,8.501058249,5.631060606,59.45021044,190.6082297,"fall ootw, ootw fall 2018, fall outfit ideas, fall outfit ideas 2018, casual fall outfit ideas, what i've been wearing lately, ootw, fall ootw college, fall ootd for school, everyday outfit ideas, outfit ideas 2018, outfit ideas fall, fall outfit of the week, fall outfits of the week 2018, outfits of the week, outfits of the week 2018, easy fall outfit ideas, summer to fall transition, simple fall outfits, ootw back to school"
New Channel Name + New Hair + Updates-RUFXK-BMs7k,20160525,Howto & Style,24553,661,2,6214,16,10.25763765,52.27572391,0.105231003,0.017739899,0.246811382,0.037537879,8.204438653,308.637862,"new channel name, channel name change, modelcitizen, bestdressed, new hair, hair transformation, dying hair at hme, brunette to blonde, life updates, how to dye your hair, how to bleach your hair, hair bleaching, hair bleaching at home"
