Name,upload_date,category,view_count,like_count,dislike_count,frames,number_shots,dark_perc_std,dark_perc_mean,saturated_perc_std,saturated_perc_mean,red_perc_std,red_perc_mean,white_perc_std,white_perc_mean,tags
DATE NIGHT OUTFIT IDEAS _ valentines day lookbook-RXxuUA2bLVo,20180212,Howto & Style,365834,14991,71,7237,159,55.9478602,97.08844697,10.71716811,3.955878227,6.260117124,3.115183081,83.84191256,205.5576845,"date night outfits, date night outfits winter, date night outfits 2018, valnetines day lookbook 2018, valentines outfit ideas, valentines day lookbook, date outfits, first date outfits, outfit ideas 2018, outfit ideas, date night outfit, outfit ideas for winter, outfit ideas winter, outfit ideas for first date, valentines outfits, outfits ideas for a date, thrifted lookbook, thrifted outfits, thrifted outfits 2018, what to wear on a first date, what to wear on a date"
Dressing for New Year's Eve on a Budget-voZyNXF54G4,20161227,Howto & Style,15009,403,4,11424,74,70.05956568,150.934359,0.580176765,0.140436552,0.297757079,0.271827624,54.94137013,157.6185711,"bestdressed, new year's eve outfit ideas, new year's eve, new year's day, new years eve party outfit ideas, new years eve party, new years eve outfits, new years eve 2017, nye outfits 2017, nye outfit, nye outfit ideas 2017, nye party outfit ideas 2017, nye outfits affordable, nye outfits on a budget, new years outfit, new years outfits 2017, new years outfit ideas 2017, new years eve outfit ideas, modelcitizen, nye 2017, last minute nye outfits, quick nye outfits"
Dying My Hair Dark Brown At Home + Color Maintenance-4RmmiwHYQcA,20170720,Howto & Style,359742,5571,73,13529,103,45.49748683,92.59734679,8.089889334,2.973313101,30.29954469,24.78149205,83.02335921,209.6904584,"dying my hair, dying my hair brown, dying hair brown, hair transformation, hair transformation light to dark, hair transformation before and after, hair color transformation before and after, hair color at home, hair color light to dark, hair color dark brown, dying my hair dark brown, dying my hair dark brown at home, watch me dye my hair, watch me dye my hair brown, wella demi permanent hair color, how to dye your hair dark brown, how i dye my hair at home"
eating 1 million pieces of cereal for 1 million subscribers-eIbYMAecsyY,20190314,Howto & Style,895796,73965,365,19070,396,38.50611378,68.80048507,46.33350399,46.67392943,30.74224159,39.8644941,55.22688411,166.3554719,"one million subscribers, 1 million subscribers, thanks a million, eating challenge, trying every cereal, taste test, cereal taste test, trying every cereal in the grocery store, every brand of cereal, unusual cereals, cinnamon toast crunch, best dressed cereal, eating one milion pieces of cereal, 10000 calorie challenge, ten thousand calorie challenge, mukbang, cereal mukbang, breakfast mukbang"
eating a bowl of cinnamon toast crunch for 100k-aAVQ7Pc0XoQ,20180712,Comedy,94704,7063,41,9603,6,30.07741745,31.03923552,0.269314394,0.193495514,2.041522717,1.526057678,61.81768528,148.6399267,"100k subscribers, hitting 100k, 100000 subscibers, bestdressed, youtube silver button, hitting 100k subscibers, 100k subscribers celebration, thank you for 100k, subsciber milestone, youtuber milestone, hitting 100 000 subscibers, reaching 100k, reaching 100k subscibers, reaching 100 000 subscibers, getting the youtuber silver play button, youtube play button, youtube silver play button, ashley bestdressed, bestdressed channel"
EXTREME BEDROOM MAKEOVER -3n99jqOdeSw,20190704,Howto & Style,4869964,249677,1962,25847,670,71.43996688,106.4773207,9.403937101,3.60190177,11.61845893,6.948779461,77.20932038,205.9389359,"room makeover, the ultimate bedroom makeover, extreme room makeover, bedroom makeover, diy bedroom makeover, bedroom makeover on a budget, apartment makeover, room tour, room makeover diy, room makeover aesthetic, carpet to hardwood, college dorm makeover, college room makeover, room makeover 2019, room makeover urban outfitters, room makeover for teen, room makeover on a budget, room makeover timelapse, room makeover for small rooms, room makeover for men"
EXTREME CLOSET CLEANOUT _marie kondo is quaking-0nFRKNt0-WI,20191010,Howto & Style,2533389,132384,646,26253,436,50.5376055,105.9691673,8.260648435,4.58592504,22.54384088,21.9941376,70.51760603,172.503654,"extreme closet cleanout, closet cleanout, closet clean out, closet cleaning, organizing my closet, cleaning my room, organizing my room, closet organization, marie kondo, closet organization for small clothes, closet declutter, declutter, closet clean out 2019, closet clean out try on, trying on everything in my closet, trying on all my clothes, closet clean out and organization, closet clean out minimalism, closet cleaning time lapse, konmari method, closet purge"
Fall 2016 Morning Routine!-EubcTc8_5d4,20161109,Howto & Style,19145,816,57,6297,6,98.38447715,357.9265215,0.384109715,0.111369195,2.93779033,0.682509053,71.90942231,21.03749762,"post election, fall 2016 morning routine, post election reaction, bestdressed, morning routine for school, morning routine fall, morning routine 2016, morning routine fall edition, morning routine fall edition 2016, morning routine fall school, morning routine fall 2016, donald trump, hilary clinton, dry humor, election 2016, election results 2016, us election results 2016, beauty video satire, funny beauty video, fall morning routine"
FALL COLLEGE OOTW + college update! -V4NZrgpUUUk,20181011,Howto & Style,587296,33680,107,9135,214,45.60832586,108.210961,13.32029598,4.520243554,18.05158458,17.24178185,50.51948268,150.7279733,"ootw, outfits of the week, ootd, outfit of the day, college ootw, outfits of the week school, school, college, ucla, film school, film school outfits, 2018, art school, ootw college, what i wear in college, fall, fall ootw, fall outfit ideas, outfit inspo, college outfits, school outfits, fall outfits, comfy outfits, fall lookbook, outfits of the week college, ootw first week of school, ootw college edition, college ootd, college ootd casual, ootw college fall"
"FALL HAUL thrifted clothes, new shoes + groovy pants-iEj6dESYW4g",20180913,Howto & Style,985113,37437,271,26499,279,34.94053262,61.07542661,4.889357973,1.200605487,6.71143654,5.611908861,49.81617006,181.8083965,"fall haul 2018, fall clothing haul, faul thrift haul, urban outfitters haul, try on haul, try on haul 2018, thrift haul try on, shoes haul, topshop, nasty gal, asos, thrift haul 2018, thrift haul vintage, back to school haul, back to college haul, fall haul clothing, nasty gal haul, shoe collection, doc martens, doc martens 1460, fall boots, fall basics, affordable clothing haul"
FALL OOTW _ thrifted outfits of the week-fT_Y66DXkWs,20171109,Howto & Style,76413,2600,13,5037,114,34.6008126,31.88871141,18.43417212,2.995512352,3.08384889,1.442603748,68.09356967,310.2341183,"ootw fall, ootw november, ootw college, fall outfits, fall outfits 2017, fall outfits 2017 for school, fall outfits for school, thrifted outfits, thrifted outfits of the week, thrifted outfti ideas, thrfited outfits 2017, college outfits of the week, college outfit ideas, outfit ideas 2017, college outfits fall, outfits of the week fall 2017, outfits of the week college, thrifted lookbook, thrifted lookbook 2017"
fall thrifted outfits of the week -dZy6A_ihA20,20190929,Howto & Style,1357513,96621,368,12022,102,43.99016539,103.9692394,0.348792363,0.041295433,8.129131895,10.71364068,40.73517129,224.636191,"outfits of the week, fall outfit ideas, outfit ideas 2019, fall ootw, ootw college, thrift haul, thrift haul 2019, fall thrift haul, thrift haul try on, try on thrift haul, how to style thrifted clothes, thrifting, come thringing with me, ootd, casual outfit ideas, fall haul, outfit ideas fall, outfit ideas for school, what i wore this week, what i've been wearing lately, outfit diaries, outfits of the week fall, fall trends, fall lookbook"
FALL TRY ON THRIFT HAUL (vintage levi's + goodwill finds)-CpIRR5WooUE,20171102,Howto & Style,720260,24528,333,31578,299,31.61714587,72.52165079,12.31566945,1.9805129,10.46180629,12.22257243,53.78112063,238.8762601,"cheap thrift haul, thrift store haul, thrift store finds, thrift store shopping, thrift haul 2017, thrift haul try on, thrift haul goodwill, thrift haul try on 2017, thrift haul vintage, thrifting try on haul, thrifting haul 2017, thrifting haul and try on, thrifted transformation, thrift diy, thrift haul for resale, thrift haul for poshmark, thrift haul fall 2017, thrift store haul designer, thrift haul levis, fall thrift haul, fall thrift haul 2017"
FASHION WEEK REVIEW (aka low key roasting designers)-NH-naB3j3v8,20180308,Howto & Style,143889,6657,78,8596,50,32.3285406,107.4267199,10.01272229,1.687689543,1.153981184,2.228502519,50.58945047,209.2409198,"nyfw 2018, nyfw, nyfw 2018 vlog, nyfw review, fashion week review, fashion review, oscars fashion review, paris fashion week 2018, paris fasion week, london fashion week, milan fashion week 2018, milan fashion week, gucci fall 2018, alexander wang fall 2018, alexander wang runway, gucci runway, runway fashion review, fashion police, fashion week runway looks, fashion week 2018, fasion week fall 2018, versace fall 2018, runway trends 2018, fashion police fashion week"
Finding My Perfect Brow Shape _ Testing 3 Different Brows-wDwQDAmG_IY,20170504,Howto & Style,21868,668,2,10737,104,46.68840539,129.8919532,0.917077053,0.364303144,12.38540075,9.764844134,80.70860055,124.6967262,"brow shape for your face, brow shape for round face, brow shape tutorial, brow shape for hooded eyes, best brow shape, change brow shape, change your brow shape, change eyebrow shape, best eyebrow shape, perfect brow shape, perfect eyebrow shape, different eyebrow shapes, different brow shapes, what brow shape, finding your brow shape, finding your eyebrow shape, different brow styles"
FRIDAY NIGHT (a short film on 16mm)-6Ank9xGBuuA,20180621,Film & Animation,177645,11680,53,5035,1,42.46141391,336.9166955,0,0,0,0,21.09573163,24.28948734,"short film, 16mm, 16mm film, ucla student film, ucla cinematography project, ucla short film, student film, 16mm student film, 16mm project, arri s, how to shoot on 16mm, bestdressed, bestdressed film, college film, feeling lonely in college, silent film, dodie 6/10, dodie 6/10 music video, dodie music video, kodak, black and white film, black and white 16mm, kodak 16mm, kodak 16mm black and white, kodal 16mm reversal"
geeking out about movies for 24 minutes straight (my favorite films)-Qk4ZWM3JFaI,20190620,Howto & Style,1107210,84152,438,35534,611,113.5819536,164.1745251,14.79947414,1.840094401,28.99394619,13.56046292,84.09814863,135.4024167,"best films of 2019, my favorite films, my favorite movies, 500 days of summer, gone girl, eternal sunshine of the spotless mind, film school, top 10 films, my 10 favorite films, best movies, best movies of all time, christopher nolan, movies to watch before you die, movies to watch this summer, best movies in history, social network, film student, sorry to bother you, film analysis, best movies to watch, best movies on netflix, best movies 2018, best movies 2019, oscars"
Get Ready With Me - High School Graduation Hair + Makeup-ZdyUlrhiWU8,20160610,Howto & Style,31585,789,10,11782,150,24.52372465,61.11120464,27.91009085,11.95340753,29.07217381,31.61089115,69.73429444,144.8832738,"graduation makeup, graduation makeup high school, high school graduation makeup, easy graduation makeup, simple graduation makeup, get ready with me graduation, get ready with me graduation 2016, grwm gradaution, grwm graduation 2016, get ready with me high school graduation, graduation makeup tutorial, graduation makeup and hair, how to put on a graduation cap, graduation hairstyles, graduation hairstyles for medium hair, graduation hairstyles 2016"
getting _litty_ on my 21st birthday-FfmcHcbGaVI,20190512,Howto & Style,1040888,68549,398,13842,370,115.3262901,164.2506294,17.06273408,6.187841961,39.93326253,32.00024238,88.33723078,99.41070113,"21st birthday, 21st birthday vlog, birthday vlog, 21st birthday outfit, 21st birthday grwm, girls night out, bars in la, la nightlife, downtown la, la clubs, la vlog, los angeles, los angeles vlog, day in my life, day in my life youtuber, day in my life la, day in the life, best dressed, college party, how to shotgun a beer"
getting my sh_t together _adult mode activate-VB73FOWqsoY,20190912,Howto & Style,2085460,138228,662,24761,551,74.90326341,164.3982702,5.406118223,0.915828072,18.41425646,16.37140152,57.75079133,118.1084438,"adulting, teenager tries adulting, teenager tries adulting for a day, day in my life, day in the life of a teenager livign alone, day in the life living alone, living alone, living along in la, trying to adult, how to get shit done, how to get your shit together, get your life together, productivity, productive day in my life, bullet journal, organization, planner layout, journaling, cleaning my messy apartment, vlog, my life in la, work day in my life, work vlog, work week"
GLOWING UP FOR 2019 (i exercised for this pls watch)-It6sVQRZ62Y,20190103,Howto & Style,2263126,111274,603,20921,593,69.2863821,108.730384,4.061582617,0.968331297,86.51709048,30.74757159,83.88096781,171.4897463,"glo up challenge, glow up challenge, trying to glow up in 48 hours, trying to glo up in 24 hours, trying to glow up in a week, ugly to less ugly transformation, 3 to 10 transformation, glowing up in a day, glowing up in 24 hours, glowing up in a week, glowing up in 2 days, glowing up in 3 days, glowing up for 2019, glowing up for the new year, workout routine, butt workout, what i eat in a day, what i eat in a day healthy, new years resolution 2019, working out, gym"
Going Platinum From Brown At Home Tutorial + Vlog-PNe780zSw3Y,20161025,Howto & Style,84871,1560,26,17996,326,43.99596281,141.9396818,4.859964861,1.039240788,6.502671984,3.671477507,27.68051908,115.4568705,"going platinum from brown, going platinum hair, going platinum at home, going platinum in one day, how to go platinum at home, how to go platinum hair, bleach hair at home, platinum hair tutorial, platinum hair at home, how to get platinum blonde hair, how to go platinum, how to dye your hair platinum white, how to dye your hair platinum, how to dye your hair white, how to dye your hair platinum at home, brown to platinum hair, dark to platinum hair"
GOODWILL TRY ON THRIFT HAUL (DIY's + 90's finds)-MAnD_Ww2EUw,20171221,Howto & Style,390845,13782,100,22634,256,34.18374172,39.50171455,5.741694884,1.180097882,5.288853896,2.789336903,41.38163941,293.0968531,"thrift haul, thrift haul 2017, winter thrift haul, try on thrift haul, try on thrift haul 2017, cheap thrift haul, thrift store finds, thrift store shopping, thrifting try on haul, thrift haul goodwill, goodwill haul, thrifting haul and try on, thrift diy, thrift haul for resale, thrift haul for poshmark, thrift haul winter, holiday thrift haul, thrift haul winter 2018, thrift haul winter 2017, thrift haul try on 2017, thrifted transformation"
High School Outfits of the Week _ Winter to Spring Transition-0Wzk-2BW9jk,20160401,Howto & Style,22065,562,4,8634,76,6.331499689,16.79522234,15.42695673,37.1247765,16.5337341,35.01438813,22.4932365,24.70738709,"outfits of the week, high school outfits of teh week, spring outfit ideas, outfit inspiration, outfits of the week high school, outfits of the week school, spring school outfits, winter to spring transition outfits, winter to spring transition 2016, outfits of the week 2016, outfits of the week for school, outfits of the week summer, outfits of the week march, outfits of the week april, outfits of the week college, winter to spring outfits, march ootw, high school ootw"
HOLIDAY OUTFIT IDEAS _ winter lookbook 2017-VOh4hXpOYKU,20171122,Howto & Style,168551,5849,62,12977,201,34.37973048,40.6891466,0.406032752,0.117747379,1.837324492,0.904870187,70.11840773,292.3584243,"holiday outfits, holiday outfit ideas, holiday outfits 2017, holiday outfit lookbook, holiday outfit diary, new years outfits, christmas outfits, winter outfit ideas, winter outfits, winter outfits 2017, winter outfit lookbook, winter lookbook, winter lookook 2017, winter lookook for school, winter outfit ideas for teenages, festive outfits, what to wear for thanksgiving, thanksgiving outfit ideas, thanksgiving outfits, thrifted winter oufits, thrifted holiday outfits"
holiday party outfit ideas,20191205,Howto & Style,1239852,99890,473,13221,226,37.69597468,54.98998547,8.711782553,2.317180557,24.84246042,22.59320565,51.52188747,153.8562067,"holiday outfit ideas, holiday outfits, what to wear on new years eve, new years outfit ideas, nye outfits, nye outfit ideas, christmas party outfits, going out outfits, going out lookbook, winter outfit ideas, winter outfits, fall outfits, ootw, outfit ideas, how to put together an outfit, holiday lookbook, winter lookbook, fall outfit ideas, winter ootw, night out lookbook, clubbing outfits, what to wear to a party, college party outfits"
holy guacamole! a thrift haul!-1LIs8qcpDb0,20190131,Howto & Style,1249229,62991,291,22946,308,54.99453375,103.7845975,9.795115126,1.597324419,4.678358059,5.989256138,51.70178397,229.6689381,"thrift haul, try on thrift haul, thrifting, try on thrift haul 2019, thrift haul 2019, goodwill haul, thrift store haul, goodwill haul 2019, online thrift haul, depop, thredup, sustainable haul, sustainable clothing, try on thrift haul winter 2019, winter haul, affordable clothing haul, thrift haul best dressed, thrift haul vintage, thrift haul goodwill, spring clothing haul, spring haul 2019, affordable haul, come thrifting with me, come thrifting with me 2019"
how i (fiNalLY) cleared my skin-UirKn4LBo_E,20181004,Howto & Style,953055,41441,296,11680,110,47.67507555,47.79990072,2.095837521,0.523748165,25.78452676,41.75920098,55.22308761,181.6387939,"how i cleared my skin, how i cleared my acne, my acne story, acne, skincare routine, skin care routine, skincare, acne skincare, skincare routine for acne, simple skincare, how to clear skin, makeup, makeup for acne, makeup for acne prone skin, makeup for acne scars, fading acne scars, acne scars, cheek acne, hyperpigmentation, how i cleared my skin naturally, how i cleared my skin fast, acne medication, dark spots"
how i do my hair-l_l8F0J1Etg,20181223,Howto & Style,751977,42607,155,12523,158,19.07826675,48.88808943,0.449511365,0.164020589,2.173237506,2.758753806,38.11672799,249.3188866,"my go to hairstyles, easy hairstyles, easy updos, easy waves, loose waves, beachy waves, how to curl your hair, everyday curls, everyday waves, easy curls, how i curl my hair, best dressed hair, hairstyles for school, hairstyles for long hair, hairstyles for medium hair, how to curl your hair overnight, how to curl your hair with a curling iron, heatless waves, heatless curls, boxer braids, heatless waves overnight, easy heatless waves, heatless waves braids"
how i edit my instagram photos + plan my feed-7xDrHUvI9j0,20190425,Howto & Style,1263066,91625,306,21364,139,46.4889144,139.3082449,3.039519767,2.024508265,4.492140779,4.77263216,49.60371059,168.8512836,"how i edit my instagram photos, lightroom tutorial, lightroom mobile tutorial, lightroom tutorial without presets, lightroom tutorial no preset, how to make lightroom presets, how to edit instagram photos, how to edit for instagram, how to edit iphone photos, how to edit photos on phone, lightroom cc, lightroom tutortial for beginners, photo editing lightroom, photo editing, color curves, aesthetic feed, how to plan instagram feed, instagram aesthetic"
how i learned to love being single (+ why you should too)-QpSAttvoGYk,20200220,Howto & Style,1324441,104623,1262,32445,157,36.90327903,54.25940318,2.244610489,0.201656896,18.08851787,13.997113,68.18154242,202.7967833,"be happy single, happily single, happy single, valentines day, vday, bestdressed boyfriend, girl talk, girl talk relationships, girl talk single, boyfriend tag, alone on valentines day, relationship advice, 20s, dating, dating advice, living alone, living alone diaries, have fun by yourself, taking myself on a date, having fun by myself, self care, why i’m single, why i love being single"
HOW I MAKE THAT BREAD (literally and figuratively)-N5YqaJ37hxs,20190526,Howto & Style,1308187,113274,366,28007,268,45.90158571,91.88861342,74.15612485,52.31076592,35.0273157,79.38588857,40.20654119,106.4351482,"how to start a business, how to budget, cost of living in LA, budget breakdown, money diaries, how much do youtubers make, how much do youtubers get paid, how to make money, how to make money as a youtuber, how to make money online, how to make money as a teenager, how to make money on instagram, how to make money from home, how much do influencers make, reselling clothes, how to sell clothes, side hustle, side hustle ideas, freelance video editor, freelance photographer"
"how i sell clothes online photos, listings, shipping + more-Q6WPYAm13sU",20191017,Howto & Style,1106078,65945,285,15678,257,76.5396965,107.7905476,5.208410014,1.470500019,22.71737901,13.42853019,75.78339855,168.2710663,"how to sell clothes, how i sell my clothes, how to sell on depop, how to sell on poshmark, how to sell clothes on depop, depop tips, selling clothes online, thrifting and reselling, starting a business, closet cleanout, selling my clothes, poshmark tips, selling on ebay, etsy business, starting a clothing business, reselling, reselling thrift clothes, online boutique, listing clothing, shipping, depop shipping, depop business"
HOW I SHOOT LOOKBOOKS BY MYSELF _ behind the scenes vlog-GgPl573GgM8,20180412,Howto & Style,266219,11611,40,15543,634,56.13466204,89.8617098,4.289678192,0.632040691,14.21933414,7.198211116,81.70086451,218.6531318,"how to shoot lookbook, how to shoot lookbook video, day in my life, day in my life vlog, day in my life as a youtuber, youtuber day in my life, behind the scenes lookbook, behind the scenes vlog, modeling vlog, how i take instagram photos, how to make youtube videos, starting a fashion channel, daily vlog, ucla vlog, how to shoot fashion video, how to film videos yourself, how to film videos alone, my camera setup, youtube camera setup, how to film youtube video"
HOW I STYLE VINTAGE _ GIRLFRIEND JEANS-auMh90hTWz8,20170907,Howto & Style,218722,4996,60,7077,83,37.67321618,16.98645708,0.09269758,0.033431062,1.987720328,0.894453005,46.14442979,348.2330152,"how to style vintage jeans, how i style vintage jeans, how to style boyfriend jeans, how to style girlfriend jeans, how to style jeans, how to style jeans for women, jeans lookbook, jeans lookbook 2017, boyfriend jeans lookbook, vintage jeans lookbook, how to style mom jeans, mom jeans lookbook, how to style distressed jeans, how to style high waisted jeans, how to style vintage jeans 2017, vintage jeans outfit ideas, denim lookbook 2017, boyfriend jeans outfit"
how i take instagram pics by myself -6AnOc6CdjSA,20180816,Howto & Style,2173127,119850,733,15868,607,72.51690544,104.4880523,1.470530945,0.501121801,63.06342972,32.66620418,76.86074232,156.6293464,"how i take instagram pictures, how i take instagram photos, how i take instagram selfies, how i take instagram photos at home, how to take instagram pictures, how to take instagram pictures by yourself, how to take instagram selfies, how to take instagram pictures at home, how to take your own pictures, how to take your own instagram photos, how to take your own photos, how to take your own travel photos, how to take better instagram pictures, photoshoot vlog"
how to be an ~aesthetic instagram teen~ ft. Avrey Ovard-7qnaz6EESpY,20190328,Howto & Style,1656147,111041,501,17368,410,34.48000173,63.68554176,46.30751311,14.60991571,54.89028298,36.47805164,77.12905338,155.4592701,"how to be an aesthetic instagram teen, turning myself into an aesthetic teen, how to pose for instagram, how to pose for photos, how to take instagram photos, how to take a selfie, avrey ovard, how to get an aesthetic feed, how i edit my instagram photos, instagram photoshoot, easy instagram poses, top 10 instagram poses, grwm, instagram tips, how to look good in photos, insatgram makeup, how to look better in photos, instagram aesthetic, how i take my instagram photos"
HOW TO BUILD A CLOTHING RACK ft. my ex-bosses-X5B7aGw0-NQ,20190509,Howto & Style,948219,62567,205,14748,416,41.45965575,76.5605614,5.354768933,2.748333677,43.83568085,37.92033601,86.23805614,177.5732512,"how to build a clothing rack, apartment makeover, bedroom makeover, small closet, closet organization, diy clothing rack, diy pipe clothing rack, pipe clothing rack, double decker clothing rack, big clothing rack, best dressed room makeover, room makeover, the sorry girls, closet makeover, clothing rack ideas, diy clothing rack wood, diy clothing rack with shelf, diy clothing rack easy, diy clothing rack copper pipe, industrial clothing rack, closet transformation"
How to Cut a Lob {Long Bob} Yourself-gUN7Wmz4yP4,20151015,Howto & Style,246031,4174,137,10987,156,35.07391153,70.47578183,17.55221954,5.288563602,26.82794248,7.93619814,67.79297937,248.5832715,"bob, lob, how to cut a lob, how to cut a bob, how to cut you hair short, how to cut your own hair, diy lob, diy bob, Do It Yourself (Hobby), angled bob, how to cut an angled lob, angled lob, how to cut your hair, how to cut your hair yourself, how to cut a lob yourself, how to cut your own lob, diy haircut, How-to (Website Category)"
